province,district,address,latitude,longitude
Nam Định,Huyện Vụ Bản,Điện máy Xanh Thị Trấn Gôi,20.331506,106.073697
Nam Định,huyện Nghĩa Hưng,Điện máy Xanh Xã Nghĩa Tân,20.05625,106.18615
Nam Định,huyện Giao Thủy,"Điện máy Xanh Thửa đất số 262, tờ bản đồ số 22, xóm 09, xã Giao Yến",20.235399,106.396503
Nam Định,Huyện Nghĩa Hưng,"Điện máy Xanh Xóm 12, Xã Nghĩa Châu",20.235769,106.134944
Nam Định,Huyện Trực Ninh,Điện máy Xanh Xã Trực Thuận,20.2470404,106.1793895
Nam Định,Tỉnh Nam Định,"Điện máy Xanh Xã Yên Dương, Huyện Ý Yên",20.329247,106.010258
Nam Định,Tỉnh Nam Định,"Điện máy Xanh Thửa đất số 38 và 39, tờ bản đồ 3-1, đội 6, Xã Liên Minh, Huyện Vụ Bản",20.3482879,106.109808
Nam Định,huyện Trực Ninh,"Điện máy Xanh Xóm Bắc Thịnh, thị trấn Cát Thành",20.2612069,106.2730644
Nam Định,H.Hải Hậu,"Điện máy Xanh Xóm 15 Trung Lễ, Xã Hải Hưng",20.198609,106.30562
Nam Định,Huyện Nam Trực,"Điện máy Xanh Thửa đất số 48, tờ bản đồ số 3, xã Nam Dương",20.328337,106.17556
Nam Định,huyện Nam Trực,Điện máy Xanh Xã Hồng Quang,20.38392,106.21741
Nam Định,huyện Trực Ninh,"Điện máy Xanh Xóm Đề Thám, xã Trực Cường",20.200491,106.215089
Nam Định,huyện Hải Hậu,"Điện máy Xanh Xóm 9, xã Hải Thịnh, huyện Hải Hậu, tỉnh Nam Định (Nay là thị trấn Thịnh Long ",20.0411361,106.2202648
Nam Định,huyện Ý Yên,Điện máy Xanh Xã Yên Đồng,20.2495117,106.0685271
Nam Định,Huyện Vụ Bản,"Điện máy Xanh Ngay Cầu Dần, Xã Trung Thành",20.382019,106.09069
Nam Định,Huyện Hải Hậu,"Điện máy Xanh Xóm 16, Xã Hải Anh",20.205103,106.261353
Nam Định,TP. Nam Định,"Số 258, Đường Hàn Thuyên, P. Trần Tế Xương",20.438562,106.18561
Nam Định,H.Trực Ninh,"Số 186 đường 21B, TT.Cổ Lễ",20.323087,106.26541
Nam Định,TP. Nam Định,"Số 458 - 460 - 462 Trần Hưng Đạo, P. Quang Trung",20.432531,106.17084
Nam Định,Tp. Nam Định,"Số 59 Đường Điện Biên, Tổ 15, Phường Cửa Bắc",20.42954,106.16726
Nam Định,TP.Nam Định,"157 Trần Hưng Đạo, P.Trần Hưng Đạo",20.4261559,106.1757815
Nam Định,TP. Nam Định,"807 Trường Chinh, P. Hạ Long",20.440418,106.18543
Nam Định,Tp. Nam Định,"Số 570-572 Giải Phóng, P. Văn Miếu",20.417752,106.16065
Nam Định,Tp. Nam Định,"Số 570-572 Giải Phóng, P. Văn Miếu",20.417752,106.16065
Nam Định,H. Vụ Bản,"Ngã 4 Gôi - phố Non Côi, TT. Gôi",20.331692,106.07443
Nghệ An,Tỉnh Nghệ An,"Điện máy Xanh Thửa đất 624, tờ bản đồ số 3, Xóm Mỹ Thượng, Xã Diễn Mỹ, Huyện Diễn Châu",19.0662266,105.6190141
Nghệ An,Huyện Yên Thành,"Điện máy Xanh Khối 1, Thị trấn Yên Thành",18.998764,105.478325
Nghệ An,huyện Diễn Châu,"Điện máy Xanh Xóm 14, xã Diễn Yên",19.09597,105.57725
Nghệ An,Huyện Diễn Châu,"Điện máy Xanh Thửa đất số 327-328-330-331, Tờ bản đồ số 05, Khối 4, Thị Trấn Diễn Châu",18.975852,105.600516
Nghệ An,huyện Anh Sơn,"Điện máy Xanh Khối 4A, Thị trấn Anh Sơn",18.932386,105.083305
Nghệ An,H. Tân Kỳ,"Điện máy Xanh Khối 7, TT. Tân Kỳ",19.051109,105.26865
Nghệ An,H. Quỳ Hợp,"Điện máy Xanh Khối 4, TT. Quỳ Hợp",19.325681,105.19001
Nghệ An,Tỉnh Nghệ An,"Điện máy Xanh Thửa đất số 1369, tờ bản đồ số 125-57, Xóm Tuần A, Xã Quỳnh Châu, Huyện Quỳnh Lưu",19.2112206,105.5423689
Nghệ An,huyện Diễn Châu,"Điện máy Xanh Xóm 14, xã Diễn An",18.980878,105.600706
Nghệ An,TP. Vinh,"Điện máy Xanh Số 7C Nguyễn Trãi, P. Quán Bầu",18.701776,105.67312
Nghệ An,Tp. Vinh,"Điện máy Xanh Số 218 Lê Duẩn, P. Trường Thi",18.665021,105.6899
Nghệ An,huyện Quỳnh Lưu,"Điện máy Xanh Thôn 5, xã Quỳnh Nghĩa",19.127438,105.714496
Nghệ An,H. Diễn Châu,"Điện máy Xanh Thôn Cầu Bùng, xã Diễn Kỷ",19.011445,105.58749
Nghệ An,Huyện Con Cuông,"Điện máy Xanh Khối 4, Thị trấn Con Cuông",19.052404,104.87538
Nghệ An,huyện Yên Thành,"Điện máy Xanh Thửa đất số 404, tờ bản đồ số 17, địa chỉ: xóm 5, xã Trung Thành",18.996542,105.466897
Nghệ An,tỉnh Nghệ An,"Điện máy Xanh Xóm Chí Thành, xã Quỳnh Bảng, huyện Quỳnh Lưu",19.14218,105.626708
Nghệ An,TP. Vinh,"Điện máy Xanh Số 7 Đường Quang Trung, P. Quang Trung",18.667165,105.67376
Nghệ An,Thị xã Thái Thòa,"Điện máy Xanh Xóm 8, xã Nghĩa Thuận",19.2706559,105.4856365
Nghệ An,thị xã Hoàng Mai,"Điện máy Xanh Khối 16, phường Quỳnh Xuân",19.212809,105.685993
Nghệ An,huyện Quỳnh Lưu,"Điện máy Xanh Xóm 3, xã Quỳnh Thạch",19.174792,105.656281
Nghệ An,Thị xã Thái Thòa,"Điện máy Xanh Xóm 8, xã Nghĩa Thuận",19.2706559,105.4856365
Nghệ An,thị xã Hoàng Mai,"Điện máy Xanh Khối 16, phường Quỳnh Xuân",19.212809,105.685993
Nghệ An,huyện Quỳnh Lưu,"Điện máy Xanh Xóm 3, xã Quỳnh Thạch",19.174792,105.656281
Nghệ An,huyện Thanh Chương,"Điện máy Xanh Thôn Trung Đức, xã Võ Liệt",18.72513,105.3675808
Nghệ An,Huyện Thanh Chương,"Điện máy Xanh Khối 4, Thị Trấn Thanh Chương",18.779702,105.33454
Nghệ An,Tỉnh Nghệ An,"Điện máy Xanh Thôn 8, Xã Đỉnh Sơn, Huyện Anh Sơn",19.028191,104.96543
Nghệ An,H. Quỳ Châu,"Điện máy Xanh Khối 2B, TT. Quỳ Châu",19.550981,105.0963
Nghệ An,huyện Tân Kỳ,"Điện máy Xanh Thửa đất số 383, tờ bản đồ số 9, địa chỉ: Xóm Cừa, xã Nghĩa Hoàn",19.1427883,105.2784406
Nghệ An,huyện Tương Dương,"Điện máy Xanh Thửa đất số154, tờ bản đồ số 12, địa chỉ: Làng Khe Bố, xã Tam Quang",19.1574665,104.6786205
Nghệ An,huyện Tương Dương,"Điện máy Xanh Thửa đất 121, tờ bản đồ số 07, Khối Hòa Tân, thị trấn Hòa Bình",19.2626761,104.4745488
Nghệ An,TX. Hoàng Mai,"Điện máy Xanh Khối 3, QL 1A, P. Quỳnh Thiện",19.252173,105.71066
Nghệ An,huyện Nghĩa Đàn,"Điện máy Xanh Xóm Chợ, xã Nghĩa Hội",19.34596,105.497709
Nghệ An,huyện Đô Lương,"Điện máy Xanh Khối 4, thị trấn Đô Lương",18.900381,105.309367
Nghệ An,Tỉnh Nghệ An,"Điện máy Xanh Xóm Trung Tâm, Xã Nghi Ân, Thành phố Vinh",18.668602,105.683662
Nghệ An,H.Nam Đàn,"Điện máy Xanh Xóm Nam Sơn, Xã Vân Diên",18.701454,105.49574
Nghệ An,Thành Phố Vinh,"Điện máy Xanh 78 Nguyễn Thị Minh Khai, Phường Hưng Bình",18.676708,105.67676
Nghệ An,Huyện Yên Thành,"Điện máy Xanh Xóm 10, Xã Bảo Thành",18.9273563,105.4767048
Nghệ An,huyện Diễn Châu,"Điện máy Xanh Thửa đất số 430, tờ bản đồ 4, xóm 1, xã Diễn Xuân",18.980878,105.600706
Nghệ An,huyện Quỳnh Lưu,"Điện máy Xanh Xóm 13, xã Sơn Hải",19.10889,105.67186
Nghệ An,TX. Thái Hòa,"Điện máy Xanh Số 116 Nguyễn Trãi, K. Kim Tân, P. Hòa Hiếu",19.322224,105.43194
Nghệ An,H. Quỳnh Lưu,"Điện máy Xanh QL1A, Khối 6, TT. Cầu Giát",19.142493,105.62643
Nghệ An,Tỉnh Nghệ An (Cách Trụ sở UBND xã Nghĩa Xuân 300m,"Điện máy Xanh Xóm Dinh, Xã Nghĩa Xuân, Huyện Quỳ Hợp",19.350458,105.290434
Nghệ An,H. Quế Phong,"Điện máy Xanh Thửa đất số 93 - 94, khối 4, TT. Kim Sơn",19.608795,104.92298
Nghệ An,TP.Vinh,"Số 78 Nguyễn Thị Minh Khai, P.Hưng Bình",18.6765362,105.6768465
Nghệ An,TP.Vinh,"Số 219 Lê Lợi, P.Lê Lợi",18.686288,105.67438
Nghệ An,Tỉnh Nghệ An,"Khối Tân Thành, Phường Hòa Hiếu, Thị xã Thái Hòa",19.320748,105.440504
Nghệ An,Huyện Yên Thành,"Quốc lộ 7B, Khối 1, TT. Yên Thành",18.998864,105.47938
Nghệ An,TP.Vinh,"92 Nguyễn Phong Sắc, phường Hưng Dũng",18.681689,105.69784
Nghệ An,H.Quỳnh Lưu,"Khối 01, đường quốc lộ 1A, TT.Cầu Giát",19.146513,105.63067
Nghệ An,TP. Vinh,"Số 6, đường Hà Huy Tập, P. Hà Huy Tập",18.687294,105.68099
Nghệ An,H.Đô Lương,"Quốc lộ 7A, khối 2, TT.Đô Lương",18.903794,105.31113
Nghệ An,TP.Vinh,"Số 2, đường Đặng Thái Thân, P.Cửa Nam",18.6670124,105.664562
Nghệ An,H. Quỳ Hợp,"Xóm Tân Mỹ, xã Tam Hợp",19.359901,105.28122
Nghệ An,H. Anh Sơn,"Khối 4B, TT. Anh Sơn",18.932085,105.08323
Nghệ An,H. Con Cuông,"Khối 4, TT. Con Cuông",19.052442,104.87524
Kon Tum,Tỉnh Kon Tum,"Điện máy Xanh Số 348 - đường Trần Hưng Đạo, Phường Quyết Thắng, Thành phố Kon Tum",14.349938,108.002778
Kon Tum,thành phố Kon Tum,"Điện máy Xanh Đường Võ Nguyên Giáp, phường Duy Tân",14.3763,108.00957
Kon Tum,huyện Kon Plong,"Điện máy Xanh Đường Võ Nguyên Giáp, tổ dân phố 3, thị trấn Măng Đen",14.603454,108.288585
Kon Tum,huyện Đăk Glei,"Điện máy Xanh Thôn 16/5, thị trấn Đăk Glei",15.074833,107.741203
Kon Tum,huyện Đăk Tô,"Điện máy Xanh Đường Hùng Vương, Khối 8, thị trấn Đăk Tô",14.646464,107.844045
Kon Tum,huyện Kon Rẫy,"Điện máy Xanh Thôn 9, xã Đăk Ruồng",14.506041,108.241512
Kon Tum,thành phố Kon Tum,"Điện máy Xanh Thôn Lâm Tùng, xã Ia Chim",14.311836,107.927928
Kon Tum,H. Đắk Hà,"Điện máy Xanh Số 296 Hùng Vương, tổ dân phố 6, TT. Đắk Hà",14.515376,107.92021
Cao Bằng,H. Hà Quảng,"Điện máy Xanh Tổ Xuân Lộc, TT. Xuân Hòa",22.902112,106.07339
Cao Bằng,Tỉnh Cao Bằng,"Điện máy Xanh Bản Vạn 1, Xã Bế Triều, Huyện Hòa An",22.733117,106.15575
Cao Bằng,Huyện Trùng Khánh,"Điện máy Xanh Tổ 3, Thị trấn Trà Lĩnh",22.824925,106.32442
Cao Bằng,H. Nguyên Bình,"Điện máy Xanh Tổ dân phố 4, TT. Nguyên Bình",22.649925,105.96009
Cao Bằng,H. Quảng Uyên,"Điện máy Xanh 125 phố Hòa Nam, TT Quảng Uyên",22.68986,106.44279
Cao Bằng,Huyện Hà Quảng,"Điện máy Xanh Xóm 5, Thị Trấn Thông Nông",22.7844367,105.9833134
Cà Mau,Huyện Trần Văn Thời,"Điện máy Xanh Khóm 9, Thị trấn Trần Văn Thời",9.074192,104.96557
Cà Mau,Huyện Cái Nước,"Điện máy Xanh Thửa đất số 197, Tờ bản đồ số 16 và Thửa Ấp Thị Tường A, Xã Hưng Mỹ",8.940371,105.012639
Cà Mau,Huyện Thới Bình,"Điện máy Xanh Ấp Nhà Máy B, Xã Tân Phú",9.346524,105.089765
Cà Mau,H. Cái Nước,"Điện máy Xanh 288, đường Quốc lộ 1A, khóm 2, TT. Cái Nước",8.9439061,105.01087
Cà Mau,Thành Phố Cà Mau,"Điện máy Xanh 18, đường Ngô Quyền, Phường 02",9.1793171,105.1468
Cà Mau,H. Trần Văn Thời,"Điện máy Xanh Khóm 7, TT. Sông Đốc",9.042334,104.83329
Cà Mau,Tỉnh Cà Mau,"Điện máy Xanh Ấp Cái Đôi, Xã Phú Tân, Huyện Phú Tân",8.869381,104.841041
Cà Mau,H. Cái Nước,"Điện máy Xanh Ấp Phấn Thạnh, xã Thạnh Phú",9.110885,105.10041
Cà Mau,Phường 8,Điện máy Xanh Số 155A đường Nguyễn Tất Thành,9.163578,105.14302
Cà Mau,huyện Đầm Dơi,"Điện máy Xanh Thửa đất số 917, tờ bản đồ số 16, ấp Chà Là, xã Trần Phán",8.964911,105.110725
Cà Mau,huyện Trần Văn Thời,"Điện máy Xanh Ấp Đá Bạc, xã Khánh Bình Tây",9.178175,104.850396
Cà Mau,H. Đầm Dơi,"Điện máy Xanh Đường 19/5, khóm 4, TT. Đầm Dơi",8.996056,105.19612
Cà Mau,H. Thới Bình,"Điện máy Xanh Khóm 8, TT. Thới Bình",9.345385,105.0895
Cà Mau,Huyện Đầm Dơi,"Điện máy Xanh Ấp Tân Long A, Xã Tân Tiến",8.968996,105.322189
Cà Mau,Huyện Ngọc Hiển,"Điện máy Xanh Ấp Lạch Vàm, Xã Đất Mũi",8.600818,104.755641
Cà Mau,Huyện Thới Bình,"Điện máy Xanh Ấp 02, Xã Trí Phải",9.405178,105.150851
Cà Mau,TP. Cà Mau,"Điện máy Xanh Số 245, ấp 3, X. Tắc Vân",9.168805,105.26943
Cà Mau,H. Thới Bình,"Điện máy Xanh Số 26, ấp 3, Xã Tân Lộc",9.281083,105.20333
Cà Mau,H. Phú Tân,"Điện máy Xanh Khóm 2, TT. Cái Đôi Vàm",8.855581,104.81093
Cà Mau,TP. Cà Mau,"Điện máy Xanh Số 12 Trần Hưng Đạo, khu phố 3B, phường 5",9.178716,105.15606
Cà Mau,Thành phố Cà Mau,"Điện máy Xanh Thửa đất số 11, Tờ bản đồ số 27, Khóm 5, Phường Tân Thành",9.1855675,105.2102832
Cà Mau,H. U Minh,"Điện máy Xanh Khóm 1, thị trấn U Minh",9.408487,104.96903
Cà Mau,Tỉnh Cà Mau,"Điện máy Xanh Ấp Đầm Cùng, Xã Trần Thới, Huyện Cái Nước",8.860434,105.017692
Cà Mau,huyện U Minh,"Điện máy Xanh Ấp 3, xã Khánh Hội",9.342701,104.828879
Cà Mau,Huyện Năm Căn,"Điện máy Xanh Số 00780 khu vực 1, đường Nguyễn Tất Thành, Khóm 2, Thị Trấn Năm Căn",8.7623941,104.99402
Cà Mau,H. Trần Văn Thời,"Khóm 7, TT. Trần Văn Thời",9.075164,104.96571
Cà Mau,TP.Cà Mau,"125B – 127 Nguyễn Tất Thành, khóm 7, P.8",9.1702609,105.1466274
Cà Mau,Huyện Năm Căn,"Số 00780 khu vực 1, đường Nguyễn Tất Thành, Khóm 2, Thị Trấn Năm Căn",8.761081,104.99379
Cà Mau,TP.Cà Mau,"52 Nguyễn Trãi, P.9",9.180822,105.14416
Cà Mau,TP. Cà Mau,"Số 255, Quốc lộ 1A, ấp 3, xã Tắc Vân",9.168258,105.26816
Cà Mau,TP.Cà Mau,"2A Trần Hưng Đạo, Khóm 6, P.5",9.176123,105.153181
Cà Mau,Huyện Trần Văn Thời,"Khóm 10, Thị Trấn Sông Đốc",9.042727,104.834758
Cà Mau,H. Đầm Dơi,"Số 57-59-61, đường Dương Thị Cẩm Vân, TT. Đầm Dơi",8.994982,105.19842
Cần Thơ,Quận Ô Môn,"Điện máy Xanh Khu vực Thới Trinh A, Phường Thới An",10.109265,105.622915
Cần Thơ,Q. Ô Môn,"Điện máy Xanh Thửa số 82, Tờ bản đồ số 59 , KV 11, p. Châu Văn Liêm",10.109394,105.624039
Cần Thơ,Q. Ninh Kiều,"Điện máy Xanh Số 8 Hòa Bình, P. An Cư",10.03489,105.78554
Cần Thơ,quận Bình Thuỷ,"Điện máy Xanh Đường Nguyễn Chí Thanh, khu vực Thới Thuận, phường Thới An Đông",10.0799447,105.6901979
Cần Thơ,Q. Bình Thủy,"Điện máy Xanh 115 Cách Mạng Tháng Tám, P. An Thới",10.069026,105.75631
Cần Thơ,Q. Ninh Kiều,"Điện máy Xanh 01 Bis, KDC 91B, Đường Nguyễn Văn Linh, P.An Khánh",10.025659,105.758483
Cần Thơ,Q. Thốt Nốt,"Điện máy Xanh Số 520, tổ 25, Quốc lộ 91, P. Thốt Nốt",10.272304,105.53027
Cần Thơ,Thành phố Cần Thơ,"Điện máy Xanh Đường Cách Mạng Tháng 8, Phường An Thới, Quận Bình Thuỷ",10.055264,105.770423
Cần Thơ,Huyện Phong Điền,"Điện máy Xanh Ấp Thới Giai, Xã Gia Xuân",9.995441,105.669002
Cần Thơ,quận Ô Môn,"Điện máy Xanh Khu vực Thới Mỹ, phường Thới Long",10.171621,105.589137
Cần Thơ,Huyện Phong Điền,"Điện máy Xanh Ấp Trường Thuận, Xã Trường Long",9.981348,105.634308
Cần Thơ,Huyện Cờ Đỏ,"Điện máy Xanh Ấp Thạnh Quới 1, Xã Trung Hưng",10.18162,105.47879
Cần Thơ,huyện Thốt Nốt,"Điện máy Xanh Ấp Quy Lân 5, xã Thạnh Quới, huyện Vĩnh Thạnh, thành phố Cần Thơ (Ấp Quy Lân 5, xã Thạnh Quới",10.213866,105.379639
Cần Thơ,Quận Bình Thủy,"Điện máy Xanh Đường Bùi Hữu Nghĩa (tỉnh 918), khu vực Bình Dương B, Phường Long Tuyền",10.022945,105.718455
Cần Thơ,Q. Ninh Kiều,"Điện máy Xanh Số 43 Mậu Thân, P. An Hòa",10.042428,105.76605
Cần Thơ,quận Bình Thủy,"Điện máy Xanh Khu vực Bình Phó B, phường Long Tuyền",10.036201,105.745188
Cần Thơ,Huyện Thới Lai,"Điện máy Xanh Ấp Phú Thọ, Xã Trường xuân",10.0048,105.535
Cần Thơ,Quận Bình Thủy,"Điện máy Xanh Đường Bùi Hữu Nghĩa, Phường Long Hòa",10.056138,105.725423
Cần Thơ,Huyện Phong Điền,"Điện máy Xanh Khu dân cư thương mại huyện Phong Điền, Thị Trấn Phong Điền",9.996312,105.669065
Cần Thơ,Huyện Thới Lai,"Điện máy Xanh Ấp Trường Trung, Xã Trường Thành",10.024513,105.613244
Cần Thơ,quận Thốt Nốt,"Điện máy Xanh Ấp Qui Thạnh 2, xã Trung Kiên, huyện Thốt Nốt, tỉnh Cần Thơ (nay là Khu vực Qui Thạnh 2, phường Trung Kiên",10.226715,105.552939
Cần Thơ,Q. Cái Răng,"Điện máy Xanh Khu Yên Hạ, P. Lê Bình",9.9997391,105.75045
Cần Thơ,Quận Thốt Nốt,"Điện máy Xanh Khu vực Tân Phú, Phường Thuận Hưng",10.218019,105.578534
Cần Thơ,Q. Bình Thủy,"Điện máy Xanh Số 189 Lê Hồng Phong, P. Trà Nóc",10.100611,105.70583
Cần Thơ,quận Ô Môn,"Điện máy Xanh Ấp Tân Thạnh, phường Trường Lạc",10.055024,105.647555
Cần Thơ,Huyện Thới Lai,"Điện máy Xanh Ấp Đông Hoà, Xã Đông Thuận",10.065477,105.55935
Cần Thơ,Q. Ô Môn,"Điện máy Xanh 1832 Quốc lộ 91, Khu Thới Hưng, P. Long Hưng",10.148519,105.57523
Cần Thơ,Quận Ninh Kiều,"Điện máy Xanh 172B Đường 3/2, Phường Hưng Lợi",10.023871,105.76728
Cần Thơ,quận Thốt Nốt,"Điện máy Xanh Thới Thạnh 2, phường Thới Thuận",10.2992738,105.5068293
Cần Thơ,Quận Cái Răng,"Điện máy Xanh Khu vực Phú Quới, Phường Thường Thạnh",9.958106,105.759833
Cần Thơ,huyện Vĩnh Thạnh,"Điện máy Xanh Ấp Phụng Quới A, thị trấn Thạnh An",10.155252,105.322625
Cần Thơ,Thị Trấn Vĩnh Thạnh,"Điện máy Xanh Lô B, Số 11,13,15,17 Quốc Lộ 80, Ấp Vĩnh Tiến",10.230489,105.39585
Cần Thơ,Huyện Thới Lai,"Điện máy Xanh Ấp Thới Thuận B, Thị Trấn Thới Lai",10.067349,105.562356
Cần Thơ,Quận Ô Môn ,"Số 1066/6 Quốc Lộ 91, Khu vực 5, P.Châu Văn Liêm",10.108925,105.62078
Cần Thơ,Q.Ninh Kiều,"217 đường 3/2, P.Hưng Lợi",10.0214059,105.7650805
Cần Thơ,H.Cờ Đỏ,"Ấp Thới Hòa, TT.Cờ Đỏ",10.095154,105.42762
Cần Thơ,Q.Bình Thủy,"26B/9 Lê Hồng Phong, P.Bình Thủy",10.074699,105.75017
Cần Thơ,H. Phong Điền,"168-169-170, Ấp Thị Tứ, TT. Phong Điền",9.9961741,105.67143
Cần Thơ,Q.Thốt Nốt,"384/17 Quốc Lộ 91, P.Thốt Nốt",10.2707417,105.5314171
Cần Thơ,Q.Ninh Kiều,"35B Cách Mạng Tháng 8, P.An Hòa",10.0476117,105.7776761
Cần Thơ,Q. Ninh Kiều,"552-554 Ba Mươi Tháng Tư, P. Hưng Lợi",10.01607,105.76401
Cần Thơ,Q.Ninh Kiều,"84-86A-86-86B Đường 30/4, P. An Phú",10.0296783,105.7798272
Cần Thơ,H. Vĩnh Thạnh,"2937 - 2939, QL 80, ấp Phụng Quới A, TT. Thạnh An",10.156094,105.32337
Cần Thơ,Q. Bình Thủy,"8A Cách Mạng Tháng 8, P. An Thới",10.060859,105.76446
Cần Thơ,Q.Ninh Kiều,"305V Nguyễn Văn Linh, Khu vực III, P.An Khánh",10.03064,105.75232
Cần Thơ,Q.Thốt Nôt,"571 ấp Thới hòa 1, P.Thới Thuận",10.315237,105.48591
Cần Thơ,H. Thới Lai,"Ấp Thới Thuận A, TT. Thới Lai",10.065477,105.55935
Cần Thơ,Quận Ninh Kiều,"403 - 405 Nguyễn Văn Cừ, Phường An Hòa",10.043965,105.76517
Cần Thơ,Q. Bình Thủy,"Lô số 30A7, KCN Trà Nóc 1, P. Trà Nóc",10.100056,105.712
Bình Thuận,H. Hàm Thuận Bắc,"Điện máy Xanh Số 406 Tổ 10, Khu phố 1, TT. Ma Lâm",11.066307,108.12934
Bình Thuận,huyện Hàm Tân,Điện máy Xanh Xã Tân Thắng,10.611195,107.63474
Bình Thuận,huyện Hàm Thuận Bắc,"Điện máy Xanh Đường Quốc Lộ 28, xã Hàm Trí",11.07298,108.130902
Bình Thuận,huyện Đức Linh,"Điện máy Xanh Đường Mê Pu, xã Mê Pu",11.187873,107.566403
Bình Thuận,Thành Phố Phan Thiết,"Điện máy Xanh 241 Trần Hưng Đạo, Phường Phú Thủy",10.933694,108.10429
Bình Thuận,huyện Hàm Thuận Nam,"Điện máy Xanh Thôn Phú Hưng, xã Hàm Mỹ",10.927914,108.041879
Bình Thuận,Tỉnh Bình Thuận,"Điện máy Xanh Thửa đất số 1023, Tờ bản đồ số 01 (10-224458+230458+224464), Thôn 02, Xã Hàm Đức, Huyện Hàm Thuận Bắc",11.032274,108.163188
Bình Thuận,H. Đức Linh,"Điện máy Xanh Số 349 đường 3/2, TT. Đức Tài",11.147694,107.5058
Bình Thuận,huyện Hàm Tân,"Điện máy Xanh Khu phố 2, thị trấn Tân Nghĩa",10.823842,107.726381
Bình Thuận,huyện Tánh Linh,Điện máy Xanh Xã Đồng Kho,11.139167,107.724333
Bình Thuận,huyện Bắc Bình,Điện máy Xanh Xã Lương Sơn,11.192637,108.364611
Bình Thuận,Huyện Tánh Linh,"Điện máy Xanh Thôn 3, Xã Măng Tố",11.210164,107.701609
Bình Thuận,TX. Lagi,"Điện máy Xanh 118 Lê Thánh Tôn, KP. Hiệp Hoà, X. Tân Hải",10.725111,107.87
Bình Thuận,Tỉnh Bình Thuận,"Điện máy Xanh Quốc lộ 1A, Ngã 3, Xóm 7, Thôn Vĩnh Phúc , Xã Vĩnh Tân, Huyện Tuy Phong",11.319199,108.78714
Bình Thuận,huyện Hàm Thuận Nam,"Điện máy Xanh Thửa đất số 142A, tờ bản đồ số 05, thôn Minh Tiến, xã Hàm Minh",10.8659666,107.922061
Bình Thuận,huyện Đức Linh,"Điện máy Xanh Thôn 1A, xã Trà Tân",11.062734,107.474415
Bình Thuận,huyện Đức Linh,Điện máy Xanh Xã Mê Pu,11.2569,107.641226
Bình Thuận,huyện Hàm Tân,Điện máy Xanh Khu phố 02 thị trấn Tân Minh,10.842109,107.633423
Bình Thuận,H.Tánh Linh,"Điện máy Xanh Số 466 Đường Trần Hưng Đạo, T.T Lạc Tánh",11.081969,107.68181
Bình Thuận,TP Phan Thiết,"Điện máy Xanh Nguyễn Hội, Phường Phú Trinh",10.93516,108.09715
Bình Thuận,TP. Phan Thiết,"Điện máy Xanh 364 Trần Hưng Đạo, P. Đức Thắng",10.924138,108.0978
Bình Thuận,Thị xã La Gi,"Điện máy Xanh Số 625-627 đường Thống Nhất, Phường Tân An",10.684136,107.749932
Bình Thuận,huyện Tánh Linh,Điện máy Xanh Xã Gia An,11.1520116,107.6217152
Bình Thuận,huyện Hàm Tân,"Điện máy Xanh Đường QL55, xã Tân Hà",10.803542,107.72101
Bình Thuận,TP. Phan Thiết,"Điện máy Xanh Số 314 Huỳnh Thúc Kháng, KP. 4, P. Mũi Né",10.93759,108.28537
Bình Thuận,Thị xã La Gi,"Điện máy Xanh 72C Lê Lợi, P.Phước Hội",10.66236,107.77428
Bình Thuận,H. Hàm Thuận Nam,"Điện máy Xanh 495 Trần Hưng Đạo, KP. Lập Hòa, TT. Thuận Nam",10.840698,107.86299
Bình Thuận,H. Đức Linh,"Điện máy Xanh 397 Cách Mạng Tháng 8, TT. Võ Xu",11.187546,107.56701
Bình Thuận,huyện Hàm Thuận Bắc,"Điện máy Xanh QL1A, khu phố Phú Thành, thị trấn Phú Long",11.07298,108.130902
Bình Thuận,H. Bắc Bình,"Điện máy Xanh 240 Nguyễn Tất Thành, KP. Xuân An 2, TT. Chợ Lầu",11.221756,108.50405
Bình Thuận,H. Tuy Phong,"Điện máy Xanh Đường Lê Duẩn, TT. Liên Hương",11.225558,108.72807
Bình Thuận,H. Tuy Phong,"Điện máy Xanh 86 Thống Nhất, TT. Phan Rí Cửa",11.177028,108.56388
Bình Thuận,Tỉnh Bình Thuận,"Thửa đất số 160, Tờ bản đồ số 10, Phường Đức Long, Thành phố Phan Thiết",10.9192511,108.0887933
Bình Thuận,TP.Phan Thiết,"80 Trần Hưng Đạo, P.Phú Trinh",10.9372837,108.1035429
Bình Thuận,TX. La Gi,"156 Thống Nhất, KP. 02, P. Tân Thiện",10.663627,107.7682
Bình Thuận,H.Đức Linh,"Số 268, đường 3/2, TT.Đức Tài",11.149388,107.50676
Bình Thuận,Phan Thiết,"Số 153 Tôn Đức Thắng, P. Phú Thủy",10.933036,108.11103
Bình Thuận,H. Bắc Bình,"427 đường Nguyễn Tất Thành, khu phố Xuân An, TT. Chợ Lầu",11.220813,108.50818
Bình Thuận,H. Hàm Tân,"146-148 Hùng Vương, KP. 02, TT. Tân Nghĩa",10.82421,107.72715
Bình Thuận,Tỉnh Bình Thuận,"Số 387, Quốc lộ 28, khu phố 1, Thị Trấn Ma Lâm, Huyện Hàm Thuận Bắc",11.064599,108.129304
Bình Thuận,TP. Phan Thiết,"02 Lê Hồng Phong, P. Bình Hưng",10.929793,108.10052
Bắc Kạn,Thành Phố Bắc Kạn,"Điện máy Xanh Tổ 8B, Phường Đức Xuân",22.144284,105.83461
Bắc Kạn,H. Chợ Mới,"Điện máy Xanh Tổ 1, TT. Chợ Mới",21.886,105.78246
Bắc Kạn,huyện Chợ Đồn,"Điện máy Xanh Tổ 2A, thị trấn Bằng Lũng",22.157603,105.59571
Bắc Kạn,H. Bạch Thông,"Điện máy Xanh Phố Ngã Ba, TT. Phủ Thông",22.272272,105.87981
Bắc Kạn,H. Ba Bể,Điện máy Xanh TT. Chợ Rã,22.457361,105.73925
Bắc Kạn,H. Na Rì,"Điện máy Xanh Tổ nhân dân Pò Đon, TT. Yến Lạc",22.234697,106.18163
Bắc Kạn,huyện Ngân Sơn,Điện máy Xanh Xã Vân Tùng,22.429783,105.99639
Bắc Kạn,TP. Bắc Kạn ,"Số 45-47 đường Hùng Vương, tổ 4, P. Sông Cầu",22.149645,105.83299
Bắc Kạn,TP.Bắc Kạn,"10-12 đường Võ Nguyên Giáp, Tổ 1, P.Sông Cầu",22.152492,105.83843
Kiên Giang,Huyện An Minh,"Điện máy Xanh 210A, Khu phố 3, Thị trấn Thứ Mười Một",9.618176,104.94476
Kiên Giang,thị xã Hà Tiên,"Điện máy Xanh Khu phố 1, phường Pháo Đài",10.379302,104.482441
Kiên Giang,Thành phố Rạch Giá,"Điện máy Xanh Ấp Tà Tây, Xã Phi Thông",10.053306,105.120111
Kiên Giang,Thành phố Rạch Giá,"Điện máy Xanh 358 Nguyễn Trung Trực, Phường Vĩnh Lạc",9.99805,105.09171
Kiên Giang,Huyện Phú Quốc,"Điện máy Xanh Tổ 1, Tỉnh Lộ 47, ấp Rạch Hàm, Xã Hàm Ninh",10.180169,104.046106
Kiên Giang,H. Châu Thành,"Điện máy Xanh Số 605-607 Quốc lộ 61, KP. Minh Phú, TT. Minh Lương",9.907183,105.15722
Kiên Giang,H. Gò Quao,"Điện máy Xanh Số 72 đường 3/2, KP Phước Trung 2, TT. Gò Quao",9.7291531,105.27519
Kiên Giang,H. An Biên,"Điện máy Xanh Số 250, tổ 8, Quốc lộ 63, ấp 7 Chợ, X. Đông Thái",9.760139,105.00544
