province,district,address,latitude,longitude
Hà Giang,H. Đồng Văn,"Số nhà 100, đường 3/2, tổ 2, TT. Đồng Văn",23.277373,105.35911
Gia Lai,H. Phú Thiện,"Điện máy Xanh Quốc Lộ 25, TDP 12, TT. Phú Thiện",13.529306,108.31711
Gia Lai,Tỉnh Gia Lai,"Điện máy Xanh 272 Hùng Vương, Tổ dân phố 2, Thị trấn Đắk Pơ, Huyện Đắk Pơ",13.934529,108.640071
Gia Lai,huyện Ia Pa,"Điện máy Xanh Thôn Marin II, xã Ia Marơn",13.445461,108.443012
Gia Lai,Tp. Pleiku,"Điện máy Xanh 01 Tôn Đức Thắng, P. Yên Thế",14.030759,107.98962
Gia Lai,Tỉnh Gia Lai,"Điện máy Xanh Đường ĐT 763, Tổ Dân Phố 01, Thị Trấn Ia Ly, Huyện Chư Păh",14.205528,107.837389
Gia Lai,TP. Pleiku,"Điện máy Xanh Số 47 Trần Phú, P. Diên Hồng",13.977613,107.99676
Gia Lai,H. Ia Grai,"Điện máy Xanh 321 Hùng Vương, TT. Ia Kha",13.962087,107.8406
Gia Lai,Huyện Chư Prông,Điện máy Xanh Xã Bàu Cạn,13.857516,107.941872
Gia Lai,Tỉnh Gia Lai,"Điện máy Xanh 199 Hùng Vương, Thị Trấn Phú Túc, Huyện Krông Pa",13.202056,108.683722
Gia Lai,Tp. Pleiku,"Điện máy Xanh 279 Nguyễn Tất Thành, Phường Phù Đổng",13.972709,108.015229
Gia Lai,H. Mang Yang,"Điện máy Xanh 207 Trần Hưng Đạo, Tổ 4 , TT. Kon Dơng ",14.043535,108.25997
Gia Lai,huyện Chư Păh,"Điện máy Xanh Tổ dân phố 01, thị trấn Phú Hòa",14.1015215,107.9732543
Gia Lai,TP. Pleiku,"Điện máy Xanh số 56B-58-60A Phan Đình Phùng, tổ 11, phường Tây Sơn",13.984639,108.002703
Gia Lai,H. K'Bang,"Điện máy Xanh Đường Quang Trung, TDP 7, TT. K'Bang",14.137224,108.60356
Gia Lai,H. Chư Prông,"Điện máy Xanh Số 56 Hùng Vương, TT. Chư Prông",13.758416,107.88902
Gia Lai,H. Chư Pưh,"Điện máy Xanh QL14, TT. Nhơn Hòa",13.547023,108.09949
Gia Lai,H. Chư Sê,"Điện máy Xanh 904B Hùng Vương, TT. Chư Sê",13.692559,108.07777
Gia Lai,Thị Xã An Khê,Điện máy Xanh Số 359 Quang Trung,13.954444,108.66386
Gia Lai,Huyện Đức Cơ,"Điện máy Xanh 477 Quang Trung, Thị Trấn Chư Ty",13.799861,107.69697
Gia Lai,huyện Kông Chro,"Điện máy Xanh Đường Nguyễn Huệ, tổ 3, thị trấn Kông Chro",13.777088,108.524573
Gia Lai,TX. Ayunpa,"Điện máy Xanh Số 245 đường Trần Hưng Đạo, P. Đoàn Kết",13.404931,108.44275
Gia Lai,H.Chư Sê,"811 Hùng Vương, TT.Chư Sê",13.694139,108.07747
Gia Lai,TP.Pleiku ,"05 Nguyễn Tất Thành, P.Hoa Lư",13.985216,108.0075359
Gia Lai,Tỉnh Gia Lai,"72-74 Phan Bội Châu, Thị trấn Kbang, Huyện Kbang",14.13876,108.6017
Gia Lai,Tỉnh Gia Lai,"Số 93C Phan Đình Phùng, Phường Yên Đỗ, Thành phố Pleiku",13.981421,107.9965367
Gia Lai,Thị xã An Khê,"621 Quang Trung, Tổ 2, P.Tây Sơn",13.9540075,108.6524141
Gia Lai,TP.Pleiku,"Số 32 Lê Duẩn, P.Trà Bá",13.969983,108.02128
Gia Lai,TP.Pleiku,"412 Trường Chinh, P.Trà Bá",13.953837,108.01379
Gia Lai,H.Đắk Đoa,"475 Nguyễn Huệ, TT.Đắk Đoa",13.993576,108.12116
Gia Lai,huyện Đức Cơ,"Số 281 Đường Quang Trung, Thị Trấn Chư Ty",13.800013,107.69443
Gia Lai,Huyện Mang Yang,"Số 9, Lý Thái Tổ, Tổ Dân Phố 04, Thị Trấn Kon Dơng",14.0431819,108.2547897
Vĩnh Phúc,huyện Lập Thạch,"Điện máy Xanh Thôn Bỉnh Ri, xã Hợp Lý",21.4965678,105.4911699
Vĩnh Phúc,huyện Lập Thạch,"Điện máy Xanh Thôn Vọng Sơn, xã Triều Đề",21.336487,105.462495
Vĩnh Phúc,T. Vĩnh Phúc ( gần vòng tròn 1 Xuân Hòa,"Điện máy Xanh 116 Trường Chinh, P. Đồng Xuân, TX. Phúc Yên",21.276804,105.72901
Vĩnh Phúc,Huyện Tam Đảo,"Điện máy Xanh Thôn Tân Tiến, Xã Đạo Trù",21.496402,105.533082
Vĩnh Phúc,H. Vĩnh Tường,"Điện máy Xanh Thôn 1, X. Đại Đồng",21.270944,105.5085
Vĩnh Phúc,Huyện Tam Dương,"Điện máy Xanh Phố Me, Thị Trấn Hợp Hòa",21.377837,105.541468
Vĩnh Phúc,huyện Yên Lạc,Điện máy Xanh Xã Nguyệt Đức,21.209069,105.61294
Vĩnh Phúc,huyện Tam Đảo,"Điện máy Xanh Thôn Tích Cực, xã Hợp Châu",21.395401,105.618202
Vĩnh Phúc,huyện Lập Thạch ( nay là Huyện Sông Lô ),Điện máy Xanh Xã Tam Sơn (Nay là Thị trấn Tam Sơn),21.417328,105.402019
Vĩnh Phúc,huyện Bình Xuyên,Điện máy Xanh Xã Bá Hiến,21.31508,105.69036
Vĩnh Phúc,TP.Vĩnh Yên,"Điện máy Xanh 512-514 Đường Mê Linh, P.Khai Quang",21.303292,105.62364
Vĩnh Phúc,huyện Tam Dương,Điện máy Xanh Xã Hoàng Đan,21.333725,105.504367
Vĩnh Phúc,huyện Sông Lô,"Điện máy Xanh Thôn Phú Cường, xã Lãng Công",21.429134,105.420417
Vĩnh Phúc,TP. Vĩnh Yên,"Điện máy Xanh Thôn Đôn Hậu, P. Khai Quang",21.31105,105.61971
Vĩnh Phúc,Huyện Tam Đảo,"Điện máy Xanh Trại Mới, Thị Trấn Đại Đình",21.4484795,105.5719427
Vĩnh Phúc,Huyện Vĩnh Tường,Điện máy Xanh Xã Lũng Hòa,21.279262,105.46624
Vĩnh Phúc,H. Vĩnh Tường,"Điện máy Xanh Tổ dân phố Đội Cấn, TT. Vĩnh Tường",21.211601,105.51682
Vĩnh Phúc,huyện Bình Xuyên,"Điện máy Xanh TDP. Độc Lập, thị trấn Thanh Lãng",21.2458265,105.621262
Vĩnh Phúc,H. Bình Xuyên,"Điện máy Xanh Khu phố 2, TT. Hương Canh",21.272633,105.65011
Vĩnh Phúc,TP. Vĩnh Yên,"Điện máy Xanh 01 Nguyễn Danh Phương, tổ dân phố An Phú, P. Hội Hợp",21.293038,105.55268
Vĩnh Phúc,H. Bình Xuyên,"Điện máy Xanh Khu phố 2, TT. Hương Canh",21.272633,105.65011
Vĩnh Phúc,H.Lập Thạch,"Điện máy Xanh Khu 11, TT.Lập Thạch",21.413925,105.46388
Vĩnh Phúc,Huyện Lập Thạch,"Điện máy Xanh Tổ dân phố Hòa Bình, Thị trấn Hoa Sơn",21.4336774,105.5171147
Vĩnh Phúc,huyện Bình Xuyên,"Điện máy Xanh TDP Cổ Độ, thị trấn Gia Khánh",21.3534486,105.6321826
Vĩnh Phúc,Huyện Yên Lạc,"Điện máy Xanh Khu 3, thôn Đoài, Thị Trấn Yên Lạc",21.235308,105.574955
Vĩnh Phúc,Thị Xã Phúc Yên,"Điện máy Xanh Số 389A, đường Hai Bà Trưng, Khu 5, Xã Tiền Châu",21.230664,105.69456
Vĩnh Phúc,Tỉnh Vĩnh Phúc,"Điện máy Xanh Thôn Bắc Cường, Thị Trấn Thổ Tang, Huyện Vĩnh Tường",21.216079,105.511778
Vĩnh Phúc,TX.Phúc Yên,"Số 136 Trường Chinh, P.Đồng Xuân",21.277999,105.72977
Vĩnh Phúc,Thành phố Vĩnh Yên,"449 Hùng Vương, Phường Đồng Tâm",21.30597,105.57292
Vĩnh Phúc,TX. Phúc Yên,"26 Trần Hưng Đạo, P. Trưng Trắc",21.234845,105.70565
Vĩnh Phúc,H. Yên Lạc,"Khu 3, TT. Yên Lạc",21.234833,105.57459
Vĩnh Phúc,H. Vĩnh Tường,"Phố Mới, TT. Thổ Tang",21.259997,105.48956
Vĩnh Phúc,Huyện Bình Xuyên,"Khu phố 1, Thị Trấn Hương Canh",21.277759,105.647358
Vĩnh Phúc,TP.Vĩnh Yên,"Số 1 Phố Chùa Hà, Xã Định Trung",21.321766,105.59874
Vĩnh Phúc,H. Lập Thạch,TT. Lập Thạch,21.415576,105.461764
Vĩnh Phúc,Thành phố Vĩnh Yên,"Số 1 Mê Linh, Phường Liên Bảo",21.313646,105.597866
Vĩnh Phúc,H.Tam Dương,"Đường Quốc lộ 2C, Phố Me, Thị Trấn Hợp Hòa",21.381407,105.53991
Vĩnh Phúc,H. Vĩnh Tường,"Chợ TT. Vĩnh Tường, TT.Vĩnh Tường",21.215207,105.5143
Vĩnh Phúc,TP. Vĩnh Yên,"Dự án The City Light (Tòa nhà Chung cư), P. Khai Quang",21.3155696,105.6227722
Vĩnh Phúc,Thị xã Phúc Yên,"Số 286, đường Hai Bà Trưng, P.Hùng Vương",21.231189,105.70215
Vĩnh Long,Thành phố Vĩnh Long,"Điện máy Xanh Số 52, khóm 2, Phường 4",10.247781,105.977984
Vĩnh Long,H. Vũng Liêm,"Điện máy Xanh Đường Nam Kỳ Khởi Nghĩa, Tổ 3, Khóm 2, TT. Vũng Liêm",10.095337,106.18579
Vĩnh Long,Huyện Trà Ôn,"Điện máy Xanh Số 1, Khu Phố 3, Thị Trấn Trà Ôn",9.9640711,105.92342
Vĩnh Long,Phường 2,Điện máy Xanh 210 Lê Thái Tổ,10.254677,105.96368
Vĩnh Long,thành phố Vĩnh Long,"Điện máy Xanh Ấp Tân Qưới Đông, xã Trường An",10.262273,105.936247
Vĩnh Long,H. Tam Bình,"Điện máy Xanh Số 492, tổ 1A, ấp 8, X. Mỹ Lộc",10.112538,105.96728
Vĩnh Long,huyện Vũng Liêm,"Điện máy Xanh Ấp Phú Cường, xã Hiếu Thuận",10.035598,106.111418
Vĩnh Long,Huyện Vũng Liêm,"Điện máy Xanh Số 110, Tổ 6, ấp Giồng Ké, Xã Trung Ngãi",10.056927,106.19835
Vĩnh Long,Huyện Trà Ôn,"Điện máy Xanh Số 354, tổ NDTQ 17, ấp Vĩnh Trinh, Xã Vĩnh Xuân",9.951185,106.00577
Vĩnh Long,H. Trà Ôn,"Điện máy Xanh Số 23, tổ 7, ấp Khu Phố, X. Hựu Thành",9.960634,106.08246
Vĩnh Long,Huyện Long Hồ,"Điện máy Xanh Số 197/17, ấp Phước Yên A, Xã Phú Qưới",10.164699,105.928278
Vĩnh Long,TP. Vĩnh Long,"Điện máy Xanh Số 550 Phạm Thái Bường, khóm 5, phường 4",10.232035,105.98675
Vĩnh Long,Huyện Long Hồ,"Điện máy Xanh Số 242/20, khóm 5, Thị Trấn Long Hồ",10.200167,106.004028
Vĩnh Long,thị xã Bình Minh,"Điện máy Xanh Đường Nguyễn Văn Thảnh, tổ 1, khóm 5, phường Thành Phước",10.069735,105.81616
Vĩnh Long,Huyện Long Hồ,"Điện máy Xanh Số 177D/09, tổ 15, ấp Phú Thạnh, Xã Đồng Phú",10.307667,105.998528
Vĩnh Long,huyện Tam Bình,Điện máy Xanh Xã Long Phú,10.078389,105.912222
Vĩnh Long,H. Bình Tân,"Điện máy Xanh Ấp Tân Lộc, X. Tân Lược",10.139993,105.71755
Vĩnh Long,H. Mang Thít,"Điện máy Xanh Số 19-21-23 khóm 01, TT. Cái Nhum",10.174611,106.10907
Vĩnh Long,huyện Bình Tân,Điện máy Xanh Xã Tân Thành,10.101865,105.752457
Vĩnh Long,Huyện Vũng Liêm,"Điện máy Xanh Ấp An Điền 1, Xã Trung Hiếu",10.07465,106.157133
Vĩnh Long,H. Vũng Liêm,"Điện máy Xanh Ấp Nhơn Ngãi, X. Hiếu Phụng",10.083883,106.11923
Vĩnh Long,Huyện Long Hồ,"Điện máy Xanh Ấp An Hiệp, Xã Long An",10.151858,106.025461
Vĩnh Long,H. Tam Bình,"Điện máy Xanh Số 12 Phan Văn Đáng, Khóm 1, TT .Tam Bình",10.047752,105.9993
Vĩnh Long,huyện Vũng Liêm,"Điện máy Xanh Ấp 08, xã Tân An Luông",10.10313,106.081972
Vĩnh Long,T.Vĩnh Long,"Điện máy Xanh QL 54, tổ 50, khóm Đông Thuận, P.Đông Thuận, Tx.Bình Minh",10.045915,105.835835
Vĩnh Long,huyện Mang Thít,"Điện máy Xanh Ấp Chợ, xã Mỹ An",10.240444,106.052806
Vĩnh Long,H. Tam Bình,"Điện máy Xanh Lô 1A, Khu Đô Thị Song Phú, Ấp Phú Ninh, X. Song Phú",10.117474,105.9012
Vĩnh Long,Huyện Bình Tân,"Điện máy Xanh Quốc lộ 54, khóm Tân Thuận, Thị trấn Tân Quới",10.102456,105.753382
Vĩnh Long,H. Mang Thít,"Nguyễn Trãi, Khóm 1, TT. Cái Nhum",10.178293,106.114675
Vĩnh Long,TP. Vĩnh Long,"Số 14D-14E, đường Đinh Tiên Hoàng, khóm 4, P. 8",10.239365,105.95691
Vĩnh Long,TP.Vĩnh Long,"93B đường 2/9, khóm Hưng Đạo Vương, P.1",10.2502606,105.9741372
Vĩnh Long,H. Long Hồ,"Số 197C/17 Quốc lộ 1A, ấp Phước Yên, xã Phú Quới",10.165245,105.92833
Vĩnh Long,Thành Phố Vĩnh Long,"Số 56G, Đường Phạm Hùng, Khóm 5, Phường 9",10.25998,105.94336
Vĩnh Long,H. Tam Bình,"Phan Văn Đáng, Khóm 3, TT. Tam Bình",10.0481894,105.998942
Vĩnh Long,Tỉnh Vĩnh Long,"Thửa đất số 230, tờ bản đồ số 11, Quốc Lộ 54, Khu 7, Thị trấn Trà Ôn, Huyện Trà Ôn",9.969654,105.927587
Vĩnh Long,TX.Bình Minh,"Tổ 21, Khóm 5, P.Cái Vồn",10.07084,105.82275
Vĩnh Long,TP. Vĩnh Long,"Số 71/12 - 71/13 Phó Cơ Điều, khóm 3, P. 03",10.235063,105.96535
Vĩnh Long,TP.Vĩnh Long,"210 Lê Thái Tổ, P.02",10.254538,105.96373
Đồng Tháp,Thành Phố Sa Đéc,"Điện máy Xanh Số 90 Hùng Vương, Phường 1",10.290549,105.76693
Đồng Tháp,huyện Lấp Vò,"Điện máy Xanh Ấp An Thạnh, xã Mỹ An Hưng B",10.405663,105.607699
Đồng Tháp,Huyện Tam Nông,"Điện máy Xanh QL 30, Xã An Long",10.700521,105.38127
Đồng Tháp,Huyện Thanh Bình,"Điện máy Xanh Ấp Tân Phong, Xã Tân Huề",10.613353,105.358219
Đồng Tháp,huyện Lấp Vò,"Điện máy Xanh Ấp An Lợi B, xã Định Yên",10.310082,105.53626
Đồng Tháp,TX. Hồng Ngự,Điện máy Xanh Số 06 Thoại Ngọc Hầu,10.811495,105.34139
Đồng Tháp,huyện Tháp Mười,Điện máy Xanh Xã Đốc Binh Kiều,10.517472,105.909278
Đồng Tháp,huyện Châu Thành,"Điện máy Xanh Ấp Cụm dân cư trung tâm, xã Tân Phú Trung",10.255435,105.738306
Đồng Tháp,Huyện Lai Vung,"Điện máy Xanh Ấp Tân Bình, Xã Phong Hòa",10.171387,105.673585
Đồng Tháp,Tỉnh Đồng Tháp,"Điện máy Xanh Ấp Chiến Thắng, Xã Tân Hộ Cơ, Huyện Tân Hồng",10.9383473,105.4420023
Đồng Tháp,huyện Lấp Vò,"Điện máy Xanh Ấp Hưng Thạnh Đông, xã Long Hưng B",10.361479,105.52261
Đồng Tháp,H. Lai Vung,"Điện máy Xanh Khóm 1, TT. Lai Vung",10.285972,105.66269
Đồng Tháp,Tp. Sa Đéc,"Điện máy Xanh Khóm Tân Hòa, P. An Hòa",10.312271,105.74624
Đồng Tháp,huyện Tam Nông,"Điện máy Xanh Ấp Long Phú A, xã Phú Thành A",10.689587,105.437845
Đồng Tháp,H. Lấp Vò,"Điện máy Xanh Khóm Bình Thạnh 1, TT. Lấp Vò",10.362655,105.52446
Đồng Tháp,huyện Tam Nông,"Điện máy Xanh Ấp K10, xã Phú Hiệp",10.75646,105.511541
Đồng Tháp,huyện Cao Lãnh,"Điện máy Xanh Ấp 02, Xã Mỹ Long",10.351809,105.78254
Đồng Tháp,T. Đồng Tháp (Ngã Tư Đèn Đỏ,"Điện máy Xanh Số 74 Nguyễn Huệ, khóm 01, TT. Sa Rài, H. Tân Hồng",10.879249,105.4516
Đồng Tháp,H. Châu Thành,"Điện máy Xanh Số 62, QL. 80, khóm Mỹ Phú, TT Cái Tàu Hạ",10.26063,105.87553
Đồng Tháp,huyện Lai Vung,"Điện máy Xanh Ấp Tân Lợi, xã Tân Thành",10.256778,105.593667
Đồng Tháp,H. Tháp Mười,"Điện máy Xanh Số 119 Hùng Vương, Khóm 4, TT. Mỹ An",10.518649,105.84384
Đồng Tháp,Huyện Cao Lãnh,"Điện máy Xanh Ấp Đông Mỹ, Xã Mỹ Hội",10.395071,105.727973
Đồng Tháp,Thành phố Cao Lãnh,"Điện máy Xanh Số 03, Quốc lộ 30, Phường Mỹ Phú",10.461373,105.64381
Đồng Tháp,Huyện Châu Thành,"Điện máy Xanh Ấp Tân Thuận, Xã Tân Nhuận Đông",10.270248,105.830154
Đồng Tháp,huyện Lấp Vò,"Điện máy Xanh Ấp Khánh An, xã Tân Khánh Trung",10.37742,105.709108
Đồng Tháp,huyện Hồng Ngự,"Điện máy Xanh 12, khóm Thượng 1, thị trấn Thường Thới Tiền",10.812821,105.247648
Đồng Tháp,H. Tam Nông,"Điện máy Xanh 387 Võ Văn Kiệt, Khóm 3 , TT. Tràm Chim",10.669609,105.56234
Đồng Tháp,huyện Lai Vung,Điện máy Xanh Xã Vĩnh Thới,10.28655,105.660602
Đồng Tháp,huyện Tháp Mười,"Điện máy Xanh Ấp Mỹ Tây 2, xã Mỹ Quí",10.526167,105.724743
Đồng Tháp,TP. Cao Lãnh,"Điện máy Xanh Số nhà 1241, đường Quốc Lộ 30, khóm 01, phường 11",10.484891,105.584048
Đồng Tháp,H. Thanh Bình,"Điện máy Xanh Quốc lộ 30, Khóm Tân Đông B, TT. Thanh Bình",10.557959,105.49037
Đồng Tháp,Thành phố Cao Lãnh,Điện máy Xanh Phường 6,10.429194,105.634389
Đồng Tháp,H. Lấp Vò,"Điện máy Xanh Ấp Vĩnh Lợi, X. Vĩnh Thạnh",10.334909,105.61927
Đồng Tháp,huyện Thanh Bình,"Điện máy Xanh Ấp Bình Trung, xã Bình Thành",10.535518,105.541602
Đồng Tháp,huyện Tân Hồng,"Điện máy Xanh Ấp Tân Bảnh, xã Tân Phước",10.820402,105.514691
Đồng Tháp,Huyện Tháp Mười,"Điện máy Xanh Ấp 6B, Xã Trường Xuân",10.648871,105.78749
Đồng Tháp,H. Cao Lãnh,"Điện máy Xanh Số 114-116 Nguyễn Trãi, TT. Mỹ Thọ",10.44699,105.69498
Đồng Tháp,TP.Cao Lãnh,"83 Nguyễn Huệ, P.1",10.456291,105.63595
Đồng Tháp,TP. Sa Đéc,"Số 20 Trần Phú, Phường 1",10.296829,105.76462
Đồng Tháp,H. Cao Lãnh,X. Mỹ Long,10.440889,105.696441
Đồng Tháp,TP. Sa Đéc,"Nguyễn Sinh Sắc, Phường 01",10.290427,105.75785
Đồng Tháp,H. Tam Nông,Xã An Long,10.700729,105.381045
Đồng Tháp,H. Lai Vung,"Khóm 1, TT. Lai Vung",10.289137,105.65947
Đồng Tháp,Tỉnh Đồng Tháp,"Thửa đất số 25-27-30-31, Tờ bản đồ số 31, Thị Trấn Thanh Bình, Huyện Thanh Bình",10.5586044,105.4887087
Đồng Tháp,H. Tháp Mười,"Ấp 5A, xã Trường Xuân",10.656319,105.78451
Đồng Tháp,Huyện Cao Lãnh,Thị Trấn Mỹ Thọ,10.440889,105.696441
Đồng Tháp,H.Lấp Vò,"Số 280/1 Quốc Lộ 80, Khóm Bình Thạnh 1, TT.Lấp Vò",10.362627,105.52302
Đồng Tháp,TP.Cao Lãnh,"178 Nguyễn Huệ, P.2",10.4572851,105.6378793
Đồng Tháp,H.Châu Thành,"Số 83C, Quốc lộ 80, TT.Cái Tàu Hạ",10.260033,105.87384
Đồng Tháp,H. Tháp Mười,TT. Mỹ An,10.521361,105.847631
Đồng Tháp,H.Châu Thành,"Số 83C, Quốc lộ 80, TT.Cái Tàu Hạ",10.260033,105.87384
Đồng Tháp,TP. Cao Lãnh,Phường 11,10.486331,105.58007
Đồng Tháp,Thị xã Hồng Ngự,"Đường Hùng Vương, P.An Thạnh",10.807954,105.3414577
Đồng Tháp,H. Tân Hồng,"Số 50 Nguyễn Huệ, TT. Sa Rài",10.87986,105.45098
Đồng Tháp,Tỉnh Đồng Tháp,"Thửa đất số 1 và thửa số 2, Tờ bản đồ số 36, khóm Mỹ Trung, Phường Mỹ Phú, Thành phố Cao Lãnh",10.474928,105.64623
Đồng Tháp,TP Cao Lãnh,"Số 72 đường Phạm Hữu Lầu, phường 4",10.453059,105.63099
Đồng Tháp,H. Tam Nông,TT. Tràm Chim,10.670793,105.56015
Trà Vinh,huyện Duyên Hải,"Điện máy Xanh Ấp Rọ Say, xã Ngũ Lạc",9.608065,106.44068
Trà Vinh,H.Càng Long,"Điện máy Xanh Số 315-317, Quốc lộ 53, Khóm 5, TT.Càng Long",9.998735,106.20553
Trà Vinh,TX. Duyên Hải,"Điện máy Xanh Số 96-98, đường 2/9, khóm 1, P. 01",9.633841,106.49317
Trà Vinh,huyện Tiểu Cần,"Điện máy Xanh Khóm 1, thị trấn Cầu Quan",9.772369,106.130582
Trà Vinh,H. Càng Long,"Điện máy Xanh 41 Quốc lộ 53, ấp Nguyệt Lãng B, xã Bình Phú",9.959583,106.24356
Trà Vinh,huyện Cầu Ngang,"Điện máy Xanh Khóm 02, thị trấn Mỹ Long",9.8084,106.506586
Trà Vinh,H. Tiểu Cần,"Điện máy Xanh Số 03, quốc lộ 60, khóm 4, TT. Tiểu Cần",9.81428,106.19053
Trà Vinh,Huyện Trà Cú ,"Điện máy Xanh 186 Đường 3/2, Thị Trấn Trà Cú ",9.691318,106.25994
Trà Vinh,huyện Trà Cú,"Điện máy Xanh Ấp Trà Kha, xã Đại An",9.700615,106.259288
Trà Vinh,Tỉnh Trà Vinh,"Điện máy Xanh Số 249, Quốc Lộ 53, Khóm 1, Phường 2, Thị Xã Duyên Hải",9.686584,106.509865
Trà Vinh,Tp. Trà Vinh,"Điện máy Xanh 181 Võ Nguyên Giáp, khóm 6, P.8",9.914128,106.31425
Trà Vinh,Huyện Châu Thành,"Điện máy Xanh Khóm 02, Thị Trấn Châu Thành",9.871831,106.347378
Trà Vinh,H. Càng Long,"Điện máy Xanh Tỉnh lộ 911, ấp Tân An Chợ, X. Tân An",9.910647,106.15191
Trà Vinh,Huyện Cầu Kè,"Điện máy Xanh Khóm 5, Thị trấn Cầu Kè",9.869286,106.056224
Trà Vinh,huyện Duyên Hải,"Điện máy Xanh Khóm 06, thị trần Long Thành",9.606919,106.439701
Trà Vinh,H. Cầu Ngang,"Điện máy Xanh 177-196 Đường 3 tháng 2, khóm Mỹ Cẩm A, TT. Cầu Ngang",9.799264,106.45178
Trà Vinh,Huyện Trà Cú,"Điện máy Xanh Ấp Chợ Dưới, Xã Phước Hưng",9.759422,106.308923
Trà Vinh,Thành Phố Trà Vinh,"Điện máy Xanh 21 Điện Biên Phủ, Khóm 4, Phường 6",9.924263,106.34107
Trà Vinh,huyện Cầu Ngang,"Điện máy Xanh Ấp Chà Và, xã Vinh Kim",9.852588,106.444003
Trà Vinh,huyện Duyên Hải,"Điện máy Xanh Ấp La Bang Chợ, xã Đôn Châu",9.656472,106.380306
Trà Vinh,Xã Long Đức. Thành phố Trà Vinh,Điện máy Xanh Ấp Sa Bình,9.958729,106.339857
Trà Vinh,H. Tiểu Cần,"Khóm 2, TT. Tiểu Cần",9.811196,106.18931
Trà Vinh,TP Trà Vinh,"20 Hùng Vương, Phường 4",9.937137,106.34342
Trà Vinh,TX. Duyên Hải,"Số 127 Đường 19/5, Khóm 1, Phường 1",9.635317,106.4945119
Trà Vinh,H.Cầu Ngang,"Số 269, đường 3/2, khóm Minh Thuận B, TT. Cầu Ngang",9.7963451,106.45174
Trà Vinh,H. Càng Long,"Số 248 – 250 – 252, QL. 53, Khóm 3, TT. Càng Long",9.997245,106.205285
Trà Vinh,TP.Trà Vinh,"474B Nguyễn Đáng, Khóm 3, P.6",9.923439,106.34013
Trà Vinh,H. Trà Cú,"Số 283, đường 3/2, TT. Trà Cú",9.688557,106.26018
Trà Vinh,TP. Trà Vinh,"121D-123 Phạm Ngũ Lão, khóm 3, P. 01",9.944214,106.33964
Trà Vinh,Huyện Cầu Kè,"Số 209, Đường 30/4, Khóm 5, Thị Trấn Cầu Kè",9.8713071,106.05624
Trà Vinh,TP. Trà Vinh,"62 Điện Biên Phủ, khóm 3, P. 02",9.932574,106.34121
Sơn La,TP. Sơn La,"Điện máy Xanh 435 - 437 Chu Văn Thịnh, Tổ 11, P. Chiềng Lề",21.337916,103.91006
Sơn La,H. Mường La,"Điện máy Xanh Số 473, đường Tô Hiệu, TT. Ít Ong",21.518103,104.02553
Sơn La,Huyện Thuận Châu,"Điện máy Xanh Tiểu khu 7, Thị Trấn Thuận Châu",21.4352097,103.6922156
Sơn La,huyện Bắc Yên,Điện máy Xanh Thị trấn Bắc Yên,21.246145,104.432831
Sơn La,huyện Sông Mã,"Điện máy Xanh Tổ dân phố 10, thị trấn Sông Mã",21.051223,103.74989
Sơn La,Thành phố Sơn La,"Điện máy Xanh 335 Trần Đăng Ninh, Phường Quyết Tâm",21.306968,103.92713
Sơn La,Huyện Quỳnh Nhai,"Điện máy Xanh Xóm 5, Xã Mường Giàng",21.6492311,103.6287992
Sơn La,Tỉnh Sơn La,"Điện máy Xanh Tiểu khu 8, Thị Trấn Mộc Châu, Huyện Mộc Châu",20.840656,104.640375
Sơn La,huyện Mường La,"Điện máy Xanh Bản Giàn , xã Mường Bú",21.413212,104.012471
Sơn La,H. Mộc Châu,"Điện máy Xanh 54 Lê Thanh Nghị, tiểu khu 40, TT. Nông Trường",20.837851,104.67832
Sơn La,H. Mai Sơn,"Điện máy Xanh 91, Tiểu khu 19, TT. Hát Lót",21.196705,104.10677
Sơn La,Thành phố Sơn La,Điện máy Xanh Phường Chiềng Sinh,21.2648708,103.9799999
Sơn La,H. Thuận Châu,"Điện máy Xanh Tiểu Khu 6, X. Tông Lạnh",21.425536,103.75984
Sơn La,huyện Sông Mã,"Điện máy Xanh Bản Tân Lập, xã Chiềng Khương",20.924028,103.962639
Sơn La,huyện Yên Châu,Điện máy Xanh Xã Phiêng Khoài,20.9575,104.307806
Sơn La,H. Phù Yên,"Điện máy Xanh Khối 4, TT. Phù Yên",21.262544,104.64451
Sơn La,Huyện Yên Châu,"Điện máy Xanh Số Nhà 20 - 24,Tiểu khu 2, Thị trấn Yên Châu",21.046433,104.2994
Sơn La,H. Mai Sơn,"Điện máy Xanh Ngã 3 Cò Nòi, tiểu khu 2, X. Cò Nòi",21.129522,104.16099
Sơn La,huyện Mộc Châu,Điện máy Xanh Xã Chiềng Sơn,20.755833,104.603111
Sơn La,huyện Phù Yên,"Điện máy Xanh Bản Tân Ba, xã Gia Phù",21.263168,104.643261
Sơn La,H.Mộc Châu,"Tiểu khu 40, Thị trấn NT Mộc Châu",20.837403,104.68188
Sơn La,TP.Sơn La,"Số 1 Lò Văn Giá, P.Chiềng Lề",21.3425121,103.9089704
Sơn La,H. Thuận Châu,"Ngã 3 Chiềng Pấc, tiểu khu 4, X. Tông Lạnh",21.426347,103.75994
Sơn La,TX. Sơn La,"Số 355, Đường Lê Duẩn, Tổ 2, P. Chiềng Sinh",21.294,103.95504
Sơn La,H. Mộc Châu,"Số 2 Trần Huy Liệu, tiểu khu 7, TT. Mộc Châu",20.846569,104.64112
Sơn La,P. Quyết Thắng,Tổ 4,21.341013,103.90729
Sơn La,H. Sông Mã,Thị trấn Sông Mã,21.050639,103.751761
Sơn La,Tỉnh Sơn La,"Số 1, đường Trần Đăng Ninh, Phường Quyết Thắng, Thành phố Sơn La",21.32017,103.921722
Sơn La,H. Thuận Châu,"Tiểu khu 4, TT. Thuận Châu",21.435579,103.68945
Sóc Trăng,Huyện Cù Lao Dung,"Điện máy Xanh Ấp An Nghiệp, Xã An Thạnh 3",9.664572,106.151406
Sóc Trăng,huyện mỹ xuyên,"Điện máy Xanh Thửa đất số 839, tờ bản đồ số 10, ấp dương kiển, xã hòa tú 2",9.375337,105.890425
Sóc Trăng,huyện Kế Sách,"Điện máy Xanh Ấp An Thành, thị trấn Kế Sách",9.766682,105.983862
Sóc Trăng,thị xã Ngã Năm,"Điện máy Xanh Ấp Mỹ Thành, xã Mỹ Quới",9.467316,105.571251
Sóc Trăng,H. Thạnh Trị,"Điện máy Xanh 279 QL 1A, Ấp 1, TT. Phú Lộc",9.428924,105.74326
Sóc Trăng,TX. Vĩnh Châu,"Điện máy Xanh Khóm 2, P.01",9.331318,105.97941
Sóc Trăng,H. Mỹ Xuyên,"Điện máy Xanh Ấp khu 1, X. Thạnh Phú",9.4987901,105.84833
Sóc Trăng,Huyện Mỹ Xuyên,"Điện máy Xanh Ấp Hòa Khánh, Xã Thạnh Quới",9.4573964,105.7993873
Sóc Trăng,huyện Long phú,"Điện máy Xanh Ấp Saintard , xã Tân Thạnh",9.6229592,106.0389467
Sóc Trăng,huyện Mỹ Xuyên,"Điện máy Xanh Thửa đất 120, 121, 561, tờ bản đồ số 9, ấp cổ cò, xã Ngọc Tố",9.558065,105.990285
Sóc Trăng,huyện Kế Sách,"Điện máy Xanh Ấp Nam Hải, xã Đại Hải",9.751675,105.864522
Sóc Trăng,Huyện Kế Sách,"Điện máy Xanh Ấp Mang Cá, Xã Đại Hải",9.798987,105.856373
Sóc Trăng,H. Cù Lao Dung,"Điện máy Xanh 86 Đoàn Thế Trung, Ấp Chợ, TT. Cù Lao Dung",9.6691,106.15458
Sóc Trăng,huyện Long phú,"Điện máy Xanh Ấp Saintard , xã Tân Thạnh",9.6229592,106.0389467
Sóc Trăng,huyện Mỹ Xuyên,"Điện máy Xanh Thửa đất 120, 121, 561, tờ bản đồ số 9, ấp cổ cò, xã Ngọc Tố",9.558065,105.990285
Sóc Trăng,Huyện Trần Đề,"Điện máy Xanh Ấp Chợ, Xã Đại Ân 2",9.549129,106.167506
Sóc Trăng,H. Long Phú,"Điện máy Xanh Ấp 4, TT. Long Phú",9.607783,106.12547
Sóc Trăng,Huyện Mỹ Tú,"Điện máy Xanh Ấp Cầu Đồn, Tt.Huỳnh Hữu Nghĩa",9.635571,105.815474
Sóc Trăng,Huyện Trần Đề,"Điện máy Xanh Ấp Giồng Giữa, Thị Trấn Lịch Hội Thượng",9.478341,106.147158
Sóc Trăng,Thị xã Ngã Năm,"Điện máy Xanh Ấp Long Thạnh, Xã Tân Long",9.524243,105.671434
Sóc Trăng,thị xã Ngã Năm,"Điện máy Xanh Khóm 1, phường 2",9.62036,105.658325
Sóc Trăng,thị xã Ngã Năm,"Điện máy Xanh Khóm 1, phường 1",9.560795,105.600216
