province,district,address,latitude,longitude
Sóc Trăng,H. Châu Thành,"Điện máy Xanh Số nhà 77, ấp Xây Đá, TT. Châu Thành",9.707164,105.89686
Sóc Trăng,Phường 6,"Điện máy Xanh 99 Hùng Vương, Khóm 1",9.616531,105.96577
Sóc Trăng,Huyện Trần Đề,"Điện máy Xanh Thửa đất số 157, tờ bản đồ 16, ấp Đầu Giồng, Thị Trấn Trần Đề",9.519101,106.19291
Sóc Trăng,H. Mỹ Xuyên,"Điện máy Xanh Ấp Chợ Cũ, TT. Mỹ Xuyên",9.564444,105.98008
Sóc Trăng,huyện Thạnh Trị,"Điện máy Xanh Ấp 15, xã Vĩnh Lợi",9.450801,105.630348
Sóc Trăng,Huyện Châu Thành,"Điện máy Xanh Ấp Châu Thành, Xã An Ninh",9.600902,105.910822
Sóc Trăng,Huyện Kế Sách,"Điện máy Xanh Ấp Ninh Thới, Xã Thới An Hội",9.838113,105.956495
Sóc Trăng,thị xã Vĩnh Châu,"Điện máy Xanh Ấp Ca Lạc, xã Lạc Hòa",9.360416,106.072318
Sóc Trăng,Huyện Kế Sách,"Điện máy Xanh Ấp An Ninh, TT An Lạc Thôn",9.927646,105.894751
Sóc Trăng,H.Mỹ Xuyên,"01 Tỉnh Lộ 8, ấp Thạnh Lợi, TT.Mỹ Xuyên",9.559691,105.99042
Sóc Trăng,TP. Sóc Trăng,"Số 267-269, đường Lê Hồng Phong, khóm 4, P. 3",9.593075,105.9745
Sóc Trăng,H. Kế Sách,"Ấp An Định, đường Phan Văn Hùng, TT. Kế Sách",9.769862,105.98341
Sóc Trăng,TP.Sóc Trăng,"13-15A Hùng Vương, P.06",9.610815,105.9701
Sóc Trăng,H. Long Phú,"Ấp Ngãi Hội, TT. Đại Ngãi",9.731792,106.06975
Sóc Trăng,TX.Vĩnh Châu,"53-54, Nguyễn Huệ, P.01",9.323949,105.98029
Sóc Trăng,TP. Sóc Trăng,"Số 2 Trần Hưng Đạo, P. 2",9.602066,105.97356
Sóc Trăng,thị xã Ngã Năm,"Đường Mai Thanh Thế, khóm 1",9.564027,105.59711
Sóc Trăng,Phường 01,50 - 52 Đường Hai Bà Trưng,9.603934,105.97446
Ninh Thuận,TP.Phan Rang - Tháp Chàm,"Điện máy Xanh 119 đường 21/8, khu 9, P.Phước Mỹ",11.574361,108.98244
Ninh Thuận,huyện Thuận Bắc,"Điện máy Xanh Thôn Ấn Đạt, xã Lợi Hải",11.717315,109.061698
Ninh Thuận,huyện Ninh Phước,"Điện máy Xanh Thôn Ninh Quý, xã Phước Sơn",11.525722,108.929336
Quảng Ninh,Tỉnh Quảng Ninh,"Điện máy Xanh Khu 4, Phường Vàng Danh, Thành phố Uông Bí",21.0983277,106.7968847
Ninh Thuận,Huyện Ninh Phước,"Điện máy Xanh Thôn Hiếu Lễ, Xã Phước Hậu",11.577938,108.92477
Ninh Thuận,Huyện Thuận Nam,Điện máy Xanh Khu quy hoạch cảng cá Cà Ná mở rộng,11.343303,108.8889
Ninh Thuận,Huyện Ninh Hải,"Điện máy Xanh Thôn Lương Cách, Xã Hộ Hải",11.62942,108.995934
Ninh Thuận,huyện Ninh Hải,"Điện máy Xanh Thôn Mỹ Tường 2, xã Nhơn Hải",11.582492,109.116129
Ninh Thuận,TP.Phan Rang - Tháp Chàm,"Điện máy Xanh Số 671 đường 21/8, P.Bảo An",11.592951,108.95462
Ninh Thuận,phường Đông Hải,Điện máy Xanh Khu phố 03,11.548804,109.023533
Ninh Thuận,H. Ninh Sơn,"Điện máy Xanh Quốc lộ 27, Thôn Hạnh Trí 1, X. Quảng Sơn",11.746018,108.79212
Ninh Thuận,H. Ninh Phước ,"Điện máy Xanh 117 QL1A , Khu Phố 5 , TT. Phước Dân ",11.524585,108.92611
Ninh Thuận,H. Ninh Hải ,"Điện máy Xanh 137-143 Đường Yên Ninh , KP. Khánh Chữ 1 , TT. Khánh Hải ",11.597249,109.0365
Ninh Thuận,Thành phố Phan Rang – Tháp Chàm,"Điện máy Xanh 279 Ngô Gia Tự, Khu phố 5, Phường Tấn Tài",11.562753,108.99518
Ninh Thuận,H. Ninh Phước,"Số 84 QL 1A, TT. Phước Dân",11.524232,108.92749
Quảng Ninh,Tỉnh Quảng Ninh,"Điện máy Xanh Tổ 112, Khu 8B, Phường Cẩm Phú, Thành phố Cẩm Phả",21.009484,107.273044
Quảng Ninh,Tp.Cẩm Phả,"Điện máy Xanh Tổ 57 Khu 5, P.Cửa Ông",21.030591,107.36506
Quảng Ninh,Quảng Ninh (Cách Ngã Tư Ao Cá 200m,"Điện máy Xanh Số 84, khu B QH khu định cư Đông Ga Hạ Long, P. Giếng Đáy, Tp. Hạ Long",20.974191,107.017809
Quảng Ninh,H. Đầm Hà,"Điện máy Xanh Phố Trần Phú, TT. Đầm Hà",21.354874,107.58688
Quảng Ninh,thành phố Hạ Long,"Điện máy Xanh Số 155 Nguyễn Văn Cừ, Phường Hồng Hà",20.941445,107.121304
Quảng Ninh,Tỉnh Quảng Ninh,"Điện máy Xanh Số 246-248, Khu Dân Cư Tự Xây Khu 10, Thị Trấn Trới, Huyện Hoành Bồ",21.020981,106.988773
Quảng Ninh,thị xã Quảng Yên,"Điện máy Xanh QH điều chỉnh lần 2 khu dân cư xóm Cửa Tràng, Bắc Cầu Chợ Rộc, xã Tiền An",20.93805,106.82937
Quảng Ninh,thị xã Uông Bí,"Điện máy Xanh Thửa đất số 47, tờ bản đồ số 17, thôn Bí Trung, xã Phương Đông",21.039888,106.726011
Quảng Ninh,TP. Cẩm Phả,"Điện máy Xanh Khu 5, P. Mông Dương",21.065952,107.32459
Quảng Ninh,TP. Cẩm Phả,"Điện máy Xanh Số 38 Trần Phú, P. Cẩm Tây",21.010577,107.28763
Quảng Ninh,T. Quảng Ninh (Siêu thị Hạ Trang cũ,"Điện máy Xanh 393 Trần Phú, P. Cao Xanh, TP. Hạ Long",20.971139,107.08188
Quảng Ninh,TX. Quảng Yên,"Điện máy Xanh KP. 4, P. Yên Giang",20.940249,106.79409
Quảng Ninh,thị xã Quảng Yên,"Điện máy Xanh Khu phố Đường Ngang, phường Minh Thành",21.005543,106.85725
Quảng Ninh,H. Tiên Yên,"Điện máy Xanh QL 18, Phố Long Thành,TT. Tiên Yên",21.33105,107.39713
Ninh Thuận,H. Ninh Sơn,"Số 434 đường Lê Duẩn, khu phố 3, TT. Tân Sơn",11.778186,108.78176
Ninh Thuận,TP. Phan Rang – Tháp Chàm,Phường Bảo An,11.5941,108.9506605
Ninh Thuận,Ninh Hải,"150 Yên Ninh, KP. Khánh Sơn 1, TT. Khánh Hải",11.5951389,109.0344282
Ninh Thuận,TP. Phan Rang - Tháp Chàm,"312 - 312A Thống Nhất, P. Phủ Hà",11.5709472,108.9914024
Ninh Thuận,TP. Phan Rang - Tháp Chàm ,"492 Thống Nhất , P. Mỹ Hương ",11.561973,108.98996
Quảng Ninh,Việt Nam. (Đối diện chợ Đức Dương,"Điện máy Xanh Phố Hoàng Hoa Thám, Thị Trấn Quảng Hà, Huyện Hải Hà, Tỉnh Quảng Ninh",21.450683,107.750463
Quảng Ninh,TP.Uông Bí,"Điện máy Xanh Đường Trần Nhân Tông, Tổ 7, Khu 1, P.Yên Thanh",21.033755,106.75742
Quảng Ninh,thị xã Đông Triều,"Điện máy Xanh Khu Vĩnh Tuy 1, phường Mạo Khê",21.053961,106.60723
Quảng Ninh,TP. Uông Bí,"Điện máy Xanh Tổ 5, khu Nam Tân, P. Nam Khê",21.023403,106.80937
Quảng Ninh,TX. Quảng Yên,"Điện máy Xanh Khu 7, P. Nam Hoà",20.930258,106.79692
Quảng Ninh,tỉnh Quảng Ninh (Gốc cây khế,"Điện máy Xanh 396 Vũ Văn Hiếu, Phường Hà Tu, thành phố Hạ Long",20.955803,107.14968
Quảng Ninh,H. Bình Liêu,"Điện máy Xanh Khu dân cư quy hoạch, thị trấn Bình Liêu",21.525249,107.399381
Quảng Ninh,TP. Cẩm Phả,"Điện máy Xanh Tổ 5, khu Hòa Lạc, P. Cẩm Bình",21.004416,107.28103
Quảng Ninh,T. Quảng Ninh (Đối diện Cây xăng cũ,"Điện máy Xanh Thôn Đông Sơn, X. Đông Xá, H. Vân Đồn",21.063673,107.41335
Quảng Ninh,TP. Hạ Long,"Điện máy Xanh Tòa nhà VNPT, số 1 đường 25/4, P. Bạch Đằng",20.952361,107.0848
Quảng Ninh,thành phố Cẩm Phả,"Điện máy Xanh Khu 4, phường Quang Hanh",21.0050784,107.21962
Quảng Ninh,Tỉnh Quảng Ninh,"Điện máy Xanh Khu phố 5, Phường Phong Cốc, Thị xã Quảng Yên",20.941885,106.804309
Quảng Ninh,TP. Móng Cái,"Điện máy Xanh Số 178B Hùng Vương, P. Ka Long",21.53156,107.95625
Quảng Ninh,TP. Hạ Long,"Số 230-268-269, Tổ 76, Khu 7, P. Hà Khẩu",20.980681,106.99943
Quảng Ninh,TP.Cẩm Phả,"Số 209 Đường Trần Phú, P.Cẩm Tây",21.012071,107.28415
Quảng Ninh,TP.Cẩm Phả,"617 Trần Phú, Tổ 65, P.Cẩm Thủy",21.009814,107.267669
Quảng Ninh,Tp. Móng Cái,"Khu Bắc Ka Long, P. Ninh Dương",21.534673,107.95148
Quảng Ninh,H. Hải Hà,"Số 2, phố Chu Văn An, TT. Quảng Hà",21.452612,107.75364
Quảng Ninh,H.Đông Triều,"Khu Vĩnh Thông,TT.Mạo Khê",21.056663,106.59815
Quảng Ninh,TX.Quảng Yên,"Số 13-15 phố Lê Lợi, P.Quảng Yên",20.938574,106.8016
Quảng Ninh,TP.Móng Cái,"Số 1, Đường Trần Phú, P.Trần Phú",21.532592,107.97197
Quảng Ninh,TP. Cẩm Phả,"Tổ 3, P. Cẩm Thạch",21.010105,107.25206
Quảng Ninh,TP. Cẩm Phả,"Tổ 109, khu 8B, P. Cẩm Phú",21.009908,107.33645
Quảng Ninh,TP.Uông Bí,"Số 487 Quang Trung, P.Quang Trung",21.034519,106.769852
Quảng Ninh,thành phố Cẩm Phả,"Tổ 2, Khu 5B, phường Cẩm Trung",21.004704,107.26918
Quảng Ninh,T. Quảng Ninh (ngã 3 Cầu Trắng,"Quốc lộ 18, tổ 4, khu 7, P. Hồng Hà, TP. Hạ Long",20.951146,107.13408
Quảng Ninh,huyện Vân Đồn,"Số 92, tổ 1, khu 4, thị trấn Cái Rồng",21.069344,107.41982
Quảng Ninh,TP.Hạ Long,"120 - 122 - 124 Đường Kênh Liêm, P.Cao Thắng",20.958848,107.09131
Quảng Ninh,TP. Cẩm Phả ,"Tổ 6, khu 2, P. Quang Hanh",21.008627,107.2358
Quảng Ninh,H. Hoành Bồ,"Số 62-63, TT. Trới",21.02227,106.98795
Quảng Ninh,TP. Hạ Long,"527 Hạ Long, P. Bãi Cháy",20.958407,107.02223
Quảng Ninh,Tỉnh Quảng Ninh,"Số nhà 500, Đường Quốc Lộ 18, Tổ 9, Khu 6, Phường Giếng Đáy, Thành phố Hạ Long",20.973285,107.015906
Phú Yên,Thành phố Tuy Hòa,"Điện máy Xanh Số 222 Hùng Vương, Phường 7",13.09327,109.3135
Phú Yên,thị xã Sông Cầu,"Điện máy Xanh Thôn Chánh Lộc, xã Xuân Lộc",13.5806328,109.1993584
Phú Yên,Huyện Đồng Xuân,"Điện máy Xanh Số 77 Lê Lợi, Khu phố Long Châu, Thị Trấn La Hai",13.378833,109.10484
Phú Yên,H.Sơn Hòa,"Điện máy Xanh 182 Trần Phú, TX. Củng Sơn",13.04777,108.97403
Phú Yên,Huyện Sơn Hoà,"Điện máy Xanh Thôn Ngân Điền, Xã Sơn Hà",13.061621,109.03435
Phú Yên,TP. Tuy Hòa,"Điện máy Xanh 34A Lê Lợi, P. 1",13.086817,109.30093
Phú Yên,huyện Tây Hoà,"Điện máy Xanh Thôn Mỹ Hạnh Trung 1, xã Hoà Phong",12.987465,109.095162
Phú Yên,huyện Đồng Xuân,"Điện máy Xanh Thôn Lãnh Vân, xã Xuân Lãnh",13.379515,109.104234
Phú Yên,H. Sông Hinh,"Điện máy Xanh Khóm 2, TT. Hai Riêng",12.98168,108.89093
Phú Yên,H. Tuy An,"Điện máy Xanh Ql 1 A, Kp. Trường Xuân, TT. Chí Thạnh",13.313056,109.21691
Phú Yên,Thị xã Đông Hoà,"Điện máy Xanh Đường 29, Khu Phố Phú Hiệp 2, Phường Hoà Hiệp Trung",12.996276,109.363682
Phú Yên,huyện Tây Hoà,"Điện máy Xanh Thôn Bình Thắng, xã Sơn Thành Đông",13.084321,109.299749
Phú Yên,Tỉnh Phú Yên,"Điện máy Xanh Thôn Chính Nghĩa, Xã An Phú, TP Tuy Hòa",13.1698756,109.2893523
Phú Yên,huyện Tây Hoà,Điện máy Xanh Thị trấn Phú Thứ,12.987465,109.095162
Phú Yên,huyện Tuy An,"Điện máy Xanh Thửa đất số 568 tờ bản đồ số 14, thôn Xuân Phu, xã An Ninh Tây",13.3410908,109.2537811
Phú Yên,huyện Sông Hinh,"Điện máy Xanh Thôn Tân Yên, xã Ealy",12.979622,108.768677
Phú Yên,TX.Sông Cầu,"Điện máy Xanh Số 171 Phạm Văn Đồng, P. Xuân Phú",13.456149,109.22148
Phú Yên,tỉnh Phú Yên,"Điện máy Xanh Thôn Phong Niên, Xã Hoà Thắng, Huyện Phú Hoà",13.055882,109.258226
Phú Yên,TP.Tuy Hòa,"244 B Trần Hưng Đạo, P.4",13.0878176,109.3117708
Phú Yên,H.Tuy An,"501 Quốc Lộ 1A, Thôn Chí Thạnh, TT. Chí Thạnh",13.307101,109.21575
Phú Yên,TP. Tuy Hòa,"Số 193 Nguyễn Huệ, Phường 5",13.091454,109.30536
Phú Yên,TP. Tuy Hòa,"201A Trần Hưng Đạo, P. 04",13.086284,109.307
Phú Yên,H. Đông Hòa,"Quốc Lộ 1A, thôn Thạch Chẩm, X. Hòa Xuân Tây",12.973542,109.33744
Phú Yên,TP. Tuy Hòa,"Số 294 Nguyễn Văn Linh, P. Phú Lâm",13.047695,109.31069
Ninh Bình,H. Yên Khánh,"Điện máy Xanh Phố 2, TT. Yên Ninh",20.182306,106.06358
Ninh Bình,H. Kim Sơn,"Điện máy Xanh Phố Thượng Kiệm, TT. Phát Diệm",20.091151,106.08558
Ninh Bình,H. Nho Quan,"Điện máy Xanh Phố Bái, TT. Nho Quan",20.323225,105.75087
Ninh Bình,H. Gia Viễn,"Điện máy Xanh Khu phố mới, Tỉnh lộ 477, TT. Me",20.347621,105.83296
Ninh Bình,TP Tam Điệp,"Điện máy Xanh Số 309 Quang Trung, Phường Trung Sơn",20.154589,105.91452
Ninh Bình,Thành Phố Ninh Bình,"Điện máy Xanh Số 2 Trần Hưng Đạo, Phố Phúc Trọng, Phường Phúc Thành",20.250399,105.97427
Ninh Bình,H. Yên Mô,"Điện máy Xanh Khu Trung Yên, TT. Yên Thịnh",20.161854,106.00562
Ninh Bình,Huyện Nho quan,"Điện máy Xanh Thôn Anh Trỗi, Xã Quỳnh Lưu",20.22299,105.84354
Ninh Bình,TP. Ninh Bình,"Điện máy Xanh Số 01 Lê Hồng Phong, P. Vân Giang",20.25686,105.97203
Quảng Nam,H. Núi Thành,"Điện máy Xanh 750 Phạm Văn Đồng, khối 4, TT. Núi Thành",15.426782,108.6643
Quảng Nam,Bắc Trà My,"Điện máy Xanh 59 Hùng Vương, Trà My",15.336753,108.21492
Quảng Nam,Huyện Phước Sơn,"Điện máy Xanh Khối 6, Thị Trấn Khâm Đức",15.444151,107.797099
Quảng Nam,huyện Đông Giang,"Điện máy Xanh Thôn Ngã Ba, Thị Trấn PRao",15.924666,107.649618
Quảng Nam,Tỉnh Quảng Nam,"Điện máy Xanh Thôn Phước Đức, Xã Quế Châu, Huyện Quế Sơn ",15.67233,108.221194
Quảng Nam,huyện Tiên Phước,Điện máy Xanh Xã Tiên Thọ,15.490197,108.303348
Quảng Nam,H. Thăng Bình,"Điện máy Xanh Đường Nguyễn Hoàng, TT. Hà Lam",15.742566,108.35875
Quảng Nam,Huyện Nam Trà My,Điện máy Xanh Xã Trà Mai,15.148154,108.12242
Quảng Nam,TX. Điện Bàn,"Điện máy Xanh Ngã ba Trần Nhân Tông và Tuệ Tĩnh, P. Vĩnh Điện",15.891529,108.24797
Quảng Nam,huyện Đại Lộc,"Điện máy Xanh Thôn Hà Nha, xã Đại Đồng",15.851035,108.0131129
Quảng Nam,H. Điện Bàn ,"Điện máy Xanh Quốc Lộ 1A, Thôn Bồ Mưng 2, X. Điện Thắng Bắc",15.943135,108.22218
Quảng Nam,huyện Điện Bàn,Điện máy Xanh Xã Điện Phước,15.885202,108.184555
Quảng Nam,Huyện Duy Xuyên,"Điện máy Xanh Thôn Hà Mỹ, Xã Duy Vinh",15.844873,108.3293739
Quảng Nam,huyện Nông Sơn,"Điện máy Xanh Thôn Trung Phước 3, xã Quế Trung",15.719382,108.059844
Quảng Nam,Thị xã Điện Bàn,Điện máy Xanh Phường Điện Dương,15.933,108.310161
Quảng Nam,H. Đại Lộc,"Điện máy Xanh Đường Nguyễn Tất Thành, TT. Ái Nghĩa",15.882951,108.11152
Quảng Nam,Huyện Duy Xuyên,"Điện máy Xanh Thửa đất số 121a, Tờ bản đồ số 5, Xã Duy Trung",15.821793,108.248731
Quảng Nam,Thành Phố Hội An,"Điện máy Xanh 16 Nguyễn Tất Thành, Khối Tân Hòa, Phường Tân An",15.886063,108.32159
Quảng Nam,Huyện Duy Xuyên,Điện máy Xanh Xã Duy Nghĩa,15.83869,108.277079
Quảng Nam,Huyện Đại Lộc,"Điện máy Xanh Thôn Tân An, xã Đại Lãnh",15.883077,108.112594
Quảng Nam,Thành phố Tam Kỳ,"Điện máy Xanh Đường Phan Bội Châu, Phường Tân Thạnh",15.573799,108.48179
Quảng Nam,H. Quế Sơn,"Điện máy Xanh Số 73-75 Phan Châu Trinh, TT. Đông Phú",15.672389,108.21661
Quảng Nam,Huyện Núi Thành,"Điện máy Xanh Quốc Lộ 1A, Thôn Diêm Phổ, Xã Tam Anh Nam",15.475611,108.59066
Quảng Nam,H. Hiệp Đức,"Điện máy Xanh Thôn 2, TT. Tân An",15.582334,108.10774
Quảng Nam,huyện Phú Ninh,"Điện máy Xanh Thôn kỳ phú, xã Tam Phước",15.53612,108.436097
Quảng Nam,Huyện Thăng Bình,"Điện máy Xanh Thôn Quý Thạnh 1, Xã Bình Quý",15.7129136,108.3402294
Quảng Nam,Huyện Đại Lộc,Điện máy Xanh Xã Đại Hiệp,15.925344,108.12959
Quảng Nam,TP.Tam Kỳ,"Điện máy Xanh 540 Phan Chu Trinh, P.An Sơn",15.565013,108.49449
Quảng Nam,H. Tiên Phước,"Điện máy Xanh Khối Phố Tiên Bình, TT. Tiên Kỳ",15.488546,108.30629
Quảng Nam,Huyện Phú Ninh,"Điện máy Xanh Thôn Tam Dân, Xã Tam Dân",15.525337,108.42267
Quảng Nam,huyện Thăng Bình,"Điện máy Xanh Tổ 06, thôn Phước Ấm, xã Bình Triều",15.759022,108.394777
Quảng Nam,Huyện Tây Giang,"Điện máy Xanh Khu dân cư O - CL3 Tây Bắc, Thôn Agrong, Xã A Tiêng",15.887484,107.4907497
Quảng Nam,Huyện Nam Giang,"Điện máy Xanh Thôn Dung, Thị trấn Thạnh Mỹ",15.746623,107.833435
Quảng Nam,Huyện Núi Thành,"Điện máy Xanh Thửa đất số 271, tờ bản đồ số 04, địa chỉ: xã Tam Tiến",15.43069,108.658075
Quảng Nam,H. Duy Xuyên,"Điện máy Xanh Số 90 Điện Biên Phủ, KP. Long Xuyên 2, TT. Nam Phước",15.841117,108.28313
Quảng Nam,TP. Hội An,"Điện máy Xanh 477-479 Hai Bà Trưng, Phường Tân An",15.887049,108.327594
Quảng Nam,TX. Điện Bàn,"Điện máy Xanh Khối Viêm Trung, P. Điện Ngọc",15.936128,108.25478
Quảng Nam,H. Quế Sơn,"Điện máy Xanh Thôn 8, Quốc lộ 1A, xã Hương An",15.781259,108.32893
Quảng Nam,Huyện Thăng Bình,"Điện máy Xanh Đường Quốc Lộ 1 A, X. Bình Trung, H. Quốc Lộ 1A, Xã Bình Trung",15.67278,108.41022
Quảng Nam,huyện Hiệp Đức,Điện máy Xanh Xã Bình Lâm,15.617824,108.221578
Quảng Nam,thị xã Điện Bàn,"Điện máy Xanh Thôn Hà An, xã Điện Phong",15.850192,108.249785
Quảng Nam,Huyện Đại Lộc,"Điện máy Xanh Thôn Quảng Huế, Xã Đại An",15.85278,108.12142
Quảng Nam,H. Núi Thành,"Điện máy Xanh Số 260 Phạm Văn Đồng, khối 2, TT. Núi Thành",15.435434,108.6447
Quảng Nam,Tp. Hội An,"Điện máy Xanh 371 Cửa Đại, P. Cẩm Châu",15.882418,108.34599
Quảng Nam,Huyện Đại Lộc,Điện máy Xanh Xã Đại Minh,15.84979,108.067194
Quảng Nam,TP.Tam Kỳ,"214 Phan chu Trinh, P.Phước Hòa",15.5697041,108.4875977
Quảng Nam,Tỉnh Quảng Nam,"02 Phan Chu Trinh, Phường An Mỹ, Thành phố Tam Kỳ",15.573461,108.482468
Quảng Nam,H. Duy Xuyên,"157-161 Điện Biên Phủ, TT. Nam Phước",15.841303,108.283449
Quảng Nam,TT. Điện Bàn,"Đường Trần Nhân Tông, P. Vĩnh Điện",15.894981,108.2455015
Quảng Nam,Huyện Thăng Bình,"Đường Tiểu La, Thị Trấn Hà Lam",15.7422,108.35882
Quảng Nam,H.Núi Thành,"177 Phạm Văn Đồng, Khối 2, TT.Núi Thành",15.435974,108.64406
Quảng Nam,H. Bắc Trà My,"252 Võ Nguyên Giáp, TT. Trà My",15.342541,108.22194
Quảng Nam,TP. Tam Kỳ,"622 Phan Chu Trinh, P. An Sơn",15.563506,108.49672
Quảng Nam,H.Đại Lộc,"Khu 5, TT.Ái Nghĩa",15.881821,108.12085
Quảng Nam,TP Tam Kỳ,"Số 339 Trần Cao Vân, P. An Sơn",15.559171,108.48854
Quảng Nam,TP. Hội An,"225 Lý Thường Kiệt, P.Cẩm Phô",15.8843087,108.3253428
Phú Thọ,Thành phố Việt Trì,"Điện máy Xanh Số 85 Trần Nguyên Hãn, Phường Bến Gót",21.304081,105.42165
Phú Thọ,Huyện Thanh Ba,"Điện máy Xanh Khu 8, Thị Trấn Thanh Ba",21.498774,105.13431
Phú Thọ,Huyện Sông Thao (nay là huyện Cẩm Khê),"Điện máy Xanh Ngã Tư bưu điện huyện Cẩm Khê,Thị trấn Sông Thao ",21.421639,105.13305
Phú Thọ,Huyện Tam Nông,"Điện máy Xanh Thửa đất số 129, tờ bản đồ số 11, Khu 13, Xã Cổ Tiết",21.28301,105.255742
Phú Thọ,Huyện Yên Lập,"Điện máy Xanh Khu Trung Tâm, Xã Lương Sơn",21.4531437,104.9720924
Phú Thọ,Huyện Cẩm Khê,"Điện máy Xanh Khu Minh Tân, Xã Minh Tân",21.4708789,105.0815658
Phú Thọ,Huyện Đoan Hùng,"Điện máy Xanh Ngã ba Cát Lem, Xã Bằng Luân",21.68093,105.07815
Phú Thọ,huyện Đoan Hùng,"Điện máy Xanh Thôn Ngọc Chúc 1, xã Chí Đám",21.623811,105.184327
Phú Thọ,huyện Phù Ninh,"Điện máy Xanh Số 07, khu 05, xã Tử Đà",21.411027,105.313537
Phú Thọ,H.Lâm Thao,"Điện máy Xanh Khu Tân Tiến, TT Lâm Thao",21.325407,105.28395
Phú Thọ,Huyện Cẩm Khê,"Điện máy Xanh Khu 2, Xã Phú Lạc",21.39078,105.14786
Phú Thọ,Thanh Sơn,"Điện máy Xanh Khu Tân Hương, xã Hương Cần",21.022423,105.241514
Phú Thọ,Huyện Tam Nông,"Điện máy Xanh Khu Tân Hưng, Thị Trấn Hưng Hóa",21.254324,105.291606
Phú Thọ,huyện Thanh Ba,Điện máy Xanh Xã Ninh Dân,21.496684,105.142364
Phú Thọ,huyện Phù Ninh,"Điện máy Xanh Khu 2, xã Trạm Thản",21.411027,105.313537
Phú Thọ,TX. Phú Thọ,"Điện máy Xanh Số 22 Đinh Tiên Hoàng, P. Hùng Vương",21.4047,105.21208
Phú Thọ,TX. Phú Thọ,"Điện máy Xanh Số nhà 84, khu 15, xã Phú Hộ",21.438459,105.25549
Phú Thọ,Huyện Yên Lập,"Điện máy Xanh Thôn Tân An 4, Thị Trấn Yên Lập",21.351828,105.05877
Phú Thọ,H. Tân Sơn,"Điện máy Xanh Đội 10, xã Tân Phú",21.218465,105.01643
Phú Thọ,H. Đoan Hùng,"Điện máy Xanh Số 36 Phố Đồng Tâm, TT. Đoan Hùng",21.621004,105.18816
Phú Thọ,H. Đoan Hùng,"Điện máy Xanh Đường quốc lộ 70, Khu Phố, xã Tây Cốc",21.632305,105.13213
Phú Thọ,H. Thanh Sơn,"Điện máy Xanh Phố Ba Mỏ, TT. Thanh Sơn",21.205883,105.17894
Phú Thọ,H. Thanh Thuỷ,Điện máy Xanh TT. Thanh Thuỷ,21.174287,105.28453
Phú Thọ,H. Hạ Hòa,"Điện máy Xanh Khu 8, TT. Hạ Hòa",21.56117,105.00111
Phú Thọ,huyện Thanh Thuỷ,"Điện máy Xanh Khu 22, xã Hoàng Xá",21.115137,105.281216
Phú Thọ,TP. Việt Trì,"Điện máy Xanh Số 1606A Hùng Vương, P. Gia Cẩm",21.321231,105.38595
Phú Thọ,Thanh Sơn,"Điện máy Xanh Khu trung tâm 2, xã Thu Cúc",21.27654,104.90718
Phú Thọ,huyện Phù Ninh,Điện máy Xanh Thị trấn Phong Châu,21.40756,105.31308
Phú Thọ,huyện Lâm Thao,Điện máy Xanh Thị trấn Hùng Sơn,21.35641,105.29336
Phú Thọ,huyện Lâm Thao,Điện máy Xanh Xã Tứ Xã,21.318258,105.286394
Phú Thọ,TX.Phú Thọ,"Số 84-86, phố Lê Đồng, P.Âu Cơ",21.397117,105.21993
Phú Thọ,H. Phù Ninh,"Khu Đường Nam, TT. Phong Châu",21.407194,105.3133
Phú Thọ,H. Cẩm Khê,"Khu 9, TT. Sông Thao",21.42205,105.13281
Phú Thọ,H.Thanh Sơn,"Số 18-20-22 đường 32, Phố Vàng, TT.Thanh Sơn",21.211644,105.17974
Phú Thọ,H. Thanh Thuỷ,"Khu Phố, TT. Thanh Thuỷ",21.174378,105.28429
Phú Thọ,TP. Việt Trì,"Số 1462, Đại lộ Hùng Vương, P. Tiên Cát",21.313567,105.3949
Phú Thọ,TP.Việt Trì,"2387-2389 Hùng Vương, Khu 7, P.Nông Trang",21.3280839,105.3795035
Phú Thọ,H. Tam Nông,"Khu 13, xã Cổ Tiết",21.284011,105.25693
Phú Thọ,huyện Lâm Thao,thị trấn Hùng Sơn,21.352909,105.29226
Phú Thọ,Huyện Hạ Hòa,"Khu 8, Thị Trấn Hạ Hòa",21.561302,105.003467
Phú Thọ,H. Yên Lập,"Khu Tân An 4, TT. Yên Lập",21.351235,105.05839
Phú Thọ,Huyện Đoan Hùng,"khu Tân Thành, Thị Trấn Đoan Hùng",21.625201,105.18438
Lai Châu,Thành Phố Lai Châu,"Điện máy Xanh Tổ 9, Phường Tân Phong",22.391292,103.46126
Lai Châu,huyện Phong Thổ,"Điện máy Xanh Thửa số 36, bản đồ số 92, bản Khổng Lào, xã Khổng Lào",22.533391,103.355898
Lai Châu,Huyện Mường Tè,Điện máy Xanh Thị trấn Mường Tè,22.383719,102.801589
Lai Châu,Tỉnh Lai Châu,"Điện máy Xanh Khu 5A, Thị Trấn Than Uyên, Huyện Than Uyên",21.952422,103.885024
Lai Châu,H. Tân Uyên ,"Điện máy Xanh Tổ 15, TT. Tân Uyên ",22.171398,103.75554
Lai Châu,H. Tam Đường,"Điện máy Xanh Khu F4 Trung tâm Thương Mại, TT. Tam Đường",22.32136,103.62452
Lai Châu,Thành phố Lai Châu,"Điện máy Xanh Số nhà 118, Đường Trần Hưng Đạo, Tổ 6, Phường Đoàn Kết",22.400125,103.456073
Lai Châu,H. Mường Tè,"Khu 10, TT. Mường Tè",22.383832,102.80206
Lai Châu,TP. Lai Châu,"Số 56 Trần Phú, tổ 4A, P. Tân Phong",22.394669,103.46327
Lai Châu,huyện Than Uyên,"Khu 1, thị trấn Than Uyên",21.950425,103.88286
Lai Châu,TP.Lai Châu,"Tổ dân phố 5, phường Đoàn Kết",22.399515,103.459498
Nam Định,Huyện Xuân Trường,"Điện máy Xanh Đường Liên Xã Mới, Thị trấn Xuân Trường",20.291501,106.343984
Nam Định,huyện Xuân Trường,Điện máy Xanh Xóm 10 xã Xuân Thượng,20.32969,106.32807
Nam Định,huyện Xuân Trường,"Điện máy Xanh Thửa đất số 80 và 184, tờ bản đồ số 11 và 31, xã Xuân Ninh",20.2428902,106.3241303
Nam Định,huyện Trực Ninh,"Điện máy Xanh Đường 21B, thị trấn Cổ Lễ",20.313701,106.270415
Nam Định,tỉnh Nam Định,"Điện máy Xanh Xã Hải Phú, huyện Hải Hậu",20.124056,106.232417
Nam Định,huyện Nghĩa Hưng,Điện máy Xanh Thị Trấn Quỹ Nhất,20.0511283,106.1434337
Nam Định,huyện Nam Trực,Điện máy Xanh Xã Nam Thanh,20.335159,106.177555
Nam Định,Huyện Nghĩa Hưng,"Điện máy Xanh Xóm 3, Thôn Đồng Lạc, Xã Nghĩa Lạc",20.111206,106.179132
Nam Định,Huyện Giao Thủy,"Điện máy Xanh Khu 4B, Tỉnh lộ 489, Thị Trấn Ngô Đồng",20.280564,106.44383
Nam Định,TP. Nam Định,"Điện máy Xanh Số 107, Quốc lộ 10, xã Lộc Hòa",20.438355,106.15394
Nam Định,huyện Ý Yên,"Điện máy Xanh Xóm Tân Lập, xã Yên Tiến",20.329247,106.010258
Nam Định,TP. Nam Định,"Điện máy Xanh Tổ 4, Đại Lộ Đông A, P. Lộc Vượng",20.434783,106.16314
Nam Định,Huyện Giao Thủy,"Điện máy Xanh Khu Lâm Quý, Thị Trấn Quất Lâm",20.208748,106.3669
Nam Định,huyện Nam Trực,"Điện máy Xanh Thôn Thượng Nông, xã Bình Minh",20.323386,106.213752
Nam Định,Huyện Nghĩa Hưng,"Điện máy Xanh TDP 01, Thị trấn Liễu Đề",20.223415,106.181859
Nam Định,tỉnh Nam Định,"Điện máy Xanh Thửa đất 166 và 458, tờ bản đồ số 02 và 09, khu 4B, Thị Trấn Cồn, huyện Hải Hậu",20.1234722,106.2786685
Nam Định,Tỉnh Nam Định,"Điện máy Xanh Thửa đất số 05-06, tờ bản đồ số 38, Xóm 5, Xã Hồng Thuận, Huyện Giao Thủy",20.2646416,106.4912061
